Title,Authors,Year,Venue,Citations
Agent-based modeling for predicting pedestrian trajectories around an autonomous vehicle,"M Prédhumeau, L Mancheva, J Dugdale",2022,Journal of Artificial …,36
Experimental investigation on the alleged gender-differences in pedestrian dynamics: A study reveals no gender differences in pedestrian movement behavior,"R Subaih, M Maree, M Chraibi, S Awad",2020,IEEE access,23
A data-driven model for pedestrian behavior classification and trajectory prediction,"V Papathanasopoulou, I Spyropoulou",2022,IEEE Open Journal …,19
Pedestrian trajectory prediction in pedestrian-vehicle mixed environments: A systematic review,"M Golchoubian, M Ghafurian",2023,IEEE Transactions …,20
Modelling of driver and pedestrian behaviour–a historical review,"K Babojelić, L Novacko",2020,Promet-Traffic&Transportation,14
Pedestrian Simulation Challenges: Modeling Techniques and Emerging Positioning Technologies for ITS Applications,"V Papathanasopoulou, H Perakis",2024,IEEE Transactions …,0
Vehicle-pedestrian interaction: A distributed simulation study,"E Sadraei, R Romano, N Merat",2020,Proceedings of the …,15
Pedestrian models for autonomous driving part ii: high-level models of human behavior,"F Camara, N Bellotto, S Cosar, F Weber",2020,IEEE Transactions …,126
Multi-modal pedestrian trajectory prediction for edge agents based on spatial-temporal graph,"X Zou, B Sun, D Zhao, Z Zhu, J Zhao, Y He",2020,IEEE Access,21
Pedestrian trajectory prediction in heterogeneous traffic using pose keypoints-based convolutional encoder-decoder network,"K Chen, X Song, X Ren",2020,… on Circuits and Systems for Video …,23
Spatio-semantic road space modeling for vehicle–pedestrian simulation to test automated driving systems,"B Schwab, C Beil, TH Kolbe",2020,Sustainability,23
Multi-Pedestrian Tracking and Map-Based Intention Estimation for Autonomous Driving Scenario.,"A Dehghani, L Patino-Studencki",2024,VEHITS,0
Spatiotemporal attention-based pedestrian trajectory prediction considering traffic-actor interaction,"X Zhou, W Zhao, A Wang, C Wang",2022,IEEE Transactions on …,7
A survey on motion prediction of pedestrians and vehicles for autonomous driving,"M Gulzar, Y Muhammad, N Muhammad",2021,IEEE Access,56
Psi: A pedestrian behavior dataset for socially intelligent autonomous car,"T Chen, T Jing, R Tian, Y Chen, J Domeyer",2021,arXiv preprint arXiv …,16
Review of pedestrian trajectory prediction methods: Comparing deep learning and knowledge-based approaches,"R Korbmacher, A Tordeux",2022,IEEE Transactions on Intelligent …,71
Pedestrian behavior in shared spaces with autonomous vehicles: An integrated framework and review,"M Prédhumeau, A Spalanzani",2021,IEEE Transactions on …,31
A protocol for pedestrian crossing and increased vehicular flow in smart cities,"S El Hamdani, N Benamar, M Younis",2020,Journal of Intelligent …,28
Multimodal multi-pedestrian path prediction for autonomous cars,"A Poibrenski, M Klusch, I Vozniak",2021,ACM SIGAPP Applied …,14
Modeling the interaction between vehicle yielding and pedestrian crossing behavior at unsignalized midblock crosswalks,"J Zhao, JO Malenje, J Wu, R Ma",2020,… research part F: traffic psychology and …,58
Neural differential constraint-based pedestrian trajectory prediction model in ego-centric perspective,"J Wang, H Sang, Q Liu, W Chen, Z Zhao",2024,Engineering Applications of …,0
"Behavioral-based pedestrian modeling approach: formulation, sensitivity analysis, and calibration","S Hani Hamdar, A Talebpour, K D'sa",2022,Transportation …,3
Non-probability sampling network based on anomaly pedestrian trajectory discrimination for pedestrian trajectory prediction,"Q Liu, H Sang, J Wang, W Chen, Y Liu",2024,Image and Vision Computing,1
M2p3: multimodal multi-pedestrian path prediction by self-driving cars with egocentric vision,"A Poibrenski, M Klusch, I Vozniak",2020,Proceedings of the 35th …,32
Revealing pedestrian behaviors to support the decision-making of autonomous vehicles,"I Fejes, D Földes",2020,2020 Smart City Symposium Prague (SCSP),6
Pedestrian crossing intention forecasting at unsignalized intersections using naturalistic trajectories,"E Moreno, P Denny, E Ward, J Horgan, C Eising",2023,Sensors,3
A Hierarchical Forecasting Model of Pedestrian Crossing Behaviour for Autonomous Vehicle,"G Yang, EJL Pulgarin, G Herrmann",2024,IEEE Access,0
Child-pedestrian traffic safety at crosswalks—literature review,"A Deluka-Tibljaš, S Šurdonja, I Ištoka Otković",2022,Sustainability,16
Generating scenarios with diverse pedestrian behaviors for autonomous vehicle testing,"M Priisalu, A Pirinen, C Paduraru",2022,… on Robot Learning,12
Tracking Pedestrians Under Occlusion in Parking Space.,"Z Zhou, S Yamada, Y Watanabe",2023,… Systems Science & …,1
A review of deep learning-based methods for pedestrian trajectory prediction,"BI Sighencea, RI Stanciu, CD Căleanu",2021,Sensors,57
How can i see my future? fvtraj: Using first-person view for pedestrian trajectory prediction,"H Bi, R Zhang, T Mao, Z Deng, Z Wang",2020,"… 28, 2020, Proceedings, Part VII 16",23
A Multi-Agent Model to calculate Risk on Vehicle-Pedestrian Interaction,"M Razzouqi, A Boulmakoul",2021,2021 International Conference on …,0
Coupling intention and actions of vehicle–pedestrian interaction: A virtual reality experiment study,"M Dang, Y Jin, P Hang, L Crosato, Y Sun",2024,Accident Analysis & …,0
Pedestrians' road crossing behaviour in front of automated vehicles: Results from a pedestrian simulation experiment using agent-based modelling,"SR Rad, GH de Almeida Correia",2020,… research part F: traffic …,72
BR-GAN: A pedestrian trajectory prediction model combined with behavior recognition,"SM Pang, JX Cao, MY Jian, J Lai",2022,IEEE Transactions on …,11
Airport Landside Vehicle Modelling and Pedestrian Behaviour Modelling for the Connected and Automated Era,S Gatien,2022,NA,0
Knowledge Acquisition from Pedestrian Flow Analysis using Sparse Mobile Probe Data,"RPB Neto, K Ohno, T Westfechtel, S Kojima",2021,Journal of Intelligent & …,1
Edge-Empowered Communication based Vehicle and Pedestrian Trajectory Perception System for Smart Cities,"S Chavhan, S Kumar, D Gupta",2023,IEEE Internet of …,1
Improved Gaussian Mixture Probabilistic Model for Pedestrian Trajectory Prediction of Autonomous Vehicle,"H Li, X Wang, X Su, Y Wang",2024,Recent Patents on Mechanical …,1
Simulation of pedestrian interaction with autonomous vehicles via social force model,"MM Rashid, MR Seyedi, S Jung",2024,Simulation Modelling Practice and …,4
Characterizing Structured Versus Unstructured Environments Based on Pedestrians' and Vehicles' Motion Trajectories,"M Golchoubian, M Ghafurian, NL Azad",2022,2022 IEEE 25th …,3
Pedestrian interaction with automated vehicles at uncontrolled intersections,"P Wang, S Motamedi, S Qi, X Zhou, T Zhang",2021,… research part F: traffic …,26
Pedestrian-vehicle interaction in shared space: Insights for autonomous vehicles,"Y Wang, L Hespanhol, S Worrall",2022,Proceedings of the 14th …,10
Enhancing Sustainable Mobility: Evaluating New Bicycle and Pedestrian Links to Car-Oriented Industrial Parks with ARAS-G MCDM Approach,"J Zagorskas, Z Turskis",2024,Sustainability,0
LiDAR-Based Vehicle–Pedestrian Interaction Study on Midblock Crossing Using Trajectory-Based Modified Post-Encroachment Time,"V Vasudevan, R Agarwala",2022,Transportation research …,8
Research on Intelligent Vehicle Motion Planning Based on Pedestrian Future Trajectories,"P Liu, G Du, Y Chang, M Liu",2023,World Electric Vehicle Journal,0
US walking distances and pedestrian safety outcomes+ integrating autonomous vehicles into Texas' Statewide Analysis Model,M Vellimana,2023,NA,0
Online monitoring for safe pedestrian-vehicle interactions,"P Du, Z Huang, T Liu, T Ji, K Xu, Q Gao",2020,2020 IEEE 23rd …,26
A survey on deep-learning methods for pedestrian behavior prediction from the egocentric view,"T Chen, R Tian",2021,2021 IEEE International Intelligent …,7
Application of optimized BPR function in pedestrian evacuation,"X Gong, X Zhang, W Qi, X Li",2024,… Conference on Traffic …,0
ADOPT: A system for Alerting Drivers to Occluded Pedestrian Traffic,"A Alali, S Olariu, S Jain",2023,Vehicular Communications,2
A context-aware pedestrian trajectory prediction framework for automated vehicles,"A Kalatian, B Farooq",2022,Transportation research part C: emerging …,44
Prediction of pedestrians' wait-or-go decision using trajectory data based on gradient boosting decision tree,"X Xin, N Jia, S Ling, Z He",2022,Transportmetrica B: transport dynamics,8
Simulation-based model for surrogate safety measures analysis in automated vehicle-pedestrian conflict on an urban environment,"H Alghodhaifi, S Lakshmanan",2020,Autonomous Systems …,17
Action-aware encoder-decoder network for pedestrian trajectory prediction,"J Fu, X Zhao",2023,Journal of Shanghai Jiaotong University (Science),5
How To Evaluate the Navigation of Autonomous Vehicles Around Pedestrians?,"M Kabtoul, M Prédhumeau",2023,IEEE Transactions …,2
Pedestrian intention prediction for autonomous driving using a multiple stakeholder perspective model,"K Kim, YK Lee, H Ahn, S Hahn",2020,2020 IEEE/RSJ …,13
Multi-PPTP: Multiple probabilistic pedestrian trajectory prediction in the complex junction scene,"L Li, B Zhou, J Lian, X Wang",2021,IEEE Transactions on …,2
Car First or Pedestrian First? Motion Prediction and Planning in Human-Robot Interactions,X Lian,2021,International Conference on Computing and Data …,0
Development of Vehicular-Pedestrian Traffic Counting and Forecasting Framework,CH NG,2022,NA,0
Human motion trajectory prediction: A survey,"A Rudenko, L Palmieri, M Herman",2020,… Journal of Robotics …,803
IA-LSTM: interaction-aware LSTM for pedestrian trajectory prediction,"J Yang, Y Chen, S Du, B Chen",2024,IEEE transactions on …,1
Predicting pedestrian tracks around moving vehicles based on conditional variational transformer,"Y He, Y Yang, Y Cai, C Yuan",2023,Proceedings of the …,3
Pedestrian intention prediction for autonomous vehicles: A comprehensive survey,"N Sharma, C Dhiman, S Indu",2022,Neurocomputing,32
Analysis of Vehicle‐Pedestrian Accident Risk Based on Simulation Experiments,"R Cheng, Y Pan, L Xie",2022,Mathematical Problems in …,4
Multi-scale pedestrian intent prediction using 3D joint information as spatio-temporal representation,"S Ahmed, A Al Bazi, C Saha, S Rajbhandari",2023,Expert Systems With …,7
Predicting Pedestrian Movement in Unsignalized Crossings: A Contextual Cue-Based Approach,"K Muduli, V Sahu, I Ghosh",2024,2024 16th International …,0
Summary and Reflections on Pedestrian Trajectory Prediction in the Field of Autonomous Driving,"Z Fu, K Jiang, C Xie, Y Xu, J Huang",2024,IEEE Transactions on …,0
Analysis of Pedestrian Behavior during Interaction with Autonomous Vehicles,MM Rashid,2022,NA,1
Autonomous Vehicle–Pedestrian Interaction Modeling Platform: A Case Study in Four Major Cities,"M Shoman, G Lanzaro, T Sayed",2024,Journal of Transportation …,0
Identification of pedestrian motion feature in mixed traffic conditions and anti-collision algorithm of autonomous vehicle,"C Yuan, X Wu, J Shen, L Chen, Y Cai",2023,Proceedings of the …,0
A comparison of pedestrian behavior in interactions with autonomous and human-driven vehicles: an extreme value theory approach,"G Lanzaro, T Sayed, C Fu",2023,… research part F: traffic psychology and …,7
Human trajectory prediction using similarity-based multi-model fusion,"G Habibi, JP How",2021,IEEE Robotics and Automation Letters,17
Multiagent Modeling for Pedestrian Risk Assessment,"M Razzouqi, A Boulmakoul",2022,Smart Trajectories,0
Simulation-based evaluation of a new integrated intersection control scheme for connected automated vehicles and pedestrians,"T Niels, N Mitrovic, N Dobrota",2020,Transportation …,28
Pedestrian–autonomous vehicles interaction challenges: a survey and a solution to pedestrian intent identification,"P Pandey, JV Aghav",2020,Advances in Data and Information Sciences …,9
Modeling trajectories and trajectory variation of turning vehicles at signalized intersections,"C Dias, M Iryo-Asano, M Abdullah, T Oguchi",2020,IEEE …,21
Pedestrian Intention Prediction for Autonomous Driving and Mobile Robots Using a Multiple Stakeholder Perspective Model,김경도,2021,NA,0
Interactions between autonomous vehicles and pedestrians at unsignalized mid-block crosswalks considering occlusions by opposing vehicles,"H Zhu, M Iryo-Asano, WKM Alhajyaseen",2021,Accident Analysis & …,10
Mobility trajectory generation: a survey,"X Kong, Q Chen, M Hou, H Wang, F Xia",2023,Artificial Intelligence Review,9
Teletraffic analysis of a mobile crowdsensing system: The pedestrian-to-vehicle scenario,D Miguel-Santiago,2022,International …,0
"Vehicle to pedestrian systems: Survey, challenges and recent trends","A Kabil, K Rabieh, F Kaleem, MA Azer",2022,IEEE Access,14
Enhancing Pedestrian Group Detection and Tracking Through Zone-Based Clustering,"M Chen, S Banitaan, M Maleki",2023,IEEE Access,0
trajdata: A unified interface to multiple human trajectory datasets,"B Ivanovic, G Song, I Gilitschenski",2024,Advances in Neural …,9
Collision avoidance of low speed autonomous shuttles with pedestrians,"SY Gelbal, B Aksun-Guvenc, L Guvenc",2020,International journal of automotive …,60
Implications of Connected and Autonomous Applications on Pedestrian Safety in Urban Environments,KS Brown,2022,NA,0
Modeling car-following behavior in downtown area based on unsupervised clustering and variable selection method,"DA Nguyen, J Nwadiuto, H Okuda",2020,2020 IEEE International …,2
“if you could see me through my eyes”: Predicting pedestrian perception,"J Petzold, M Wahby, F Stark, U Behrje",2022,2022 8th International …,5
Differences in pedestrian behavior at crosswalk between communicating with conventional vehicle and automated vehicle in real traffic environment,"M Taima, T Daimon",2023,Safety,4
Traffic and granular flow: the role of data and technology in the understanding of particle dynamics,"S Hamdar, A Talebpour, R Bertini",2020,Journal of Intelligent …,2
"Pedestrian support in intelligent transportation systems: challenges, solutions and open issues","S El Hamdani, N Benamar, M Younis",2020,Transportation research part C …,64
Pedestrian and vehicle behaviour prediction in autonomous vehicle system—A review,"LG Galvão, MN Huda",2023,Expert Systems with Applications,5
"On-road and online studies to investigate beliefs and behaviors of Netherlands, US and Mexico pedestrians encountering hidden-driver vehicles","J Li, R Currano, D Sirkin, D Goedicke",2020,Proceedings of the …,20
Non-Autoregressive Transformer based Ego-Motion Independent Pedestrian Trajectory Prediction on Egocentric View,"Y Kim, E Seo, C Noh, K Yi",2023,IEEE Access,0
Using deep neural networks in predicting the movement of road users,EBI SIGHENCEA,2023,NA,0
Citywide reconstruction of cross-sectional traffic flow from moving camera videos,"A Kumar, T Kashiyama, H Maeda",2021,2021 IEEE International …,16
Implicit interaction with an autonomous personal mobility vehicle: Relations of pedestrians' gaze behavior with situation awareness and perceived risks,"H Liu, T Hirayama, LY Morales Saiki",2023,International Journal of …,12
Gentlemen on the Road: Understanding How Pedestrians Interpret Yielding Behavior of Autonomous Vehicles using Machine Learning,"YK Lee, YE Rhee, JK Ryu, S Hahn",2020,arXiv preprint arXiv:2005.07872,4
Trajectron++: Dynamically-feasible trajectory forecasting with heterogeneous data,"T Salzmann, B Ivanovic, P Chakravarty",2020,Computer Vision–ECCV …,796
Review of pedestrian trajectory prediction methods,"X Tan, R Liu, S Zhang, J Li, P Ma",2022,Frontiers in Computing and …,1
Cooperative Probabilistic Trajectory Prediction under Occlusion,"A Nayak, A Eskandarian",2024,IEEE Transactions on Intelligent …,1
PV-TSC: Learning to control traffic signals for pedestrian and vehicle traffic in 6G era,"K Xu, J Huang, L Kong, J Yu",2022,IEEE Transactions on …,6
Can automated driving prevent crashes with distracted Pedestrians? An exploration of motion planning at unsignalized Mid-block crosswalks,"H Zhu, T Han, WKM Alhajyaseen, M Iryo-Asano",2022,Accident Analysis & …,13
Using context-cues and interaction for traffic-agent trajectory prediction,VP Thazha,2022,NA,0
Scoping out the scalability issues of autonomous vehicle-pedestrian interaction,"TTM Tran, C Parker, M Tomitsch",2023,Proceedings of the 15th International …,4
Survey of pedestrian action recognition techniques for autonomous driving,"L Chen, N Ma, P Wang, J Li, P Wang",2020,Tsinghua Science …,64
Game and Simulation Design for Studying Pedestrian-Automated Vehicle Interactions,"G Pappas, JE Siegel, J Rutkowski, A Schaaf",2021,arXiv preprint arXiv …,5
Communication of automated vehicles and pedestrian groups: An intercultural study on pedestrians' street crossing decisions,"P Joisten, Z Liu, N Theobald, A Webler",2021,Proceedings of Mensch …,21
Design of Real-time Pedestrian Trajectory Prediction System based on Jetson Xavier,"Q Liu, H Sang",2023,Frontiers in Computing and Intelligent Systems,0
Pedestrians' perceived vulnerability and observed behaviours relating to crossing and passing interactions with autonomous vehicles,LM Hulse,2023,Transportation research part F: traffic psychology and …,13
Autonomous vehicle evaluation: A comprehensive survey on modeling and simulation approaches,"H Alghodhaifi, S Lakshmanan",2021,IEEE Access,41
Trajectory prediction for heterogeneous traffic-agents using knowledge correction data-driven model,"X Xu, W Liu, L Yu",2022,Information Sciences,53
"Connected vehicle technologies, autonomous driving perception algorithms, and smart sustainable urban mobility behaviors in networked transport systems","E Johnson, E Nica",2021,Contemporary Readings in Law and Social Justice,48
A comprehensive survey on autonomous driving cars: A perspective view,"S Devi, P Malarvezhi, R Dayana",2020,Wireless Personal …,47
A comprehensive survey on the application of deep and reinforcement learning approaches in autonomous driving,"BB Elallid, N Benamar, AS Hafid, T Rachidi",2022,Journal of King Saud …,75
Early Detection of Occluded or Hidden Pedestrian by Using Mobile Base Station,RYT Hou,2021,… Conference on Connected and Autonomous Driving …,0
A review of virtual reality studies on autonomous vehicle–pedestrian interaction,"TTM Tran, C Parker, M Tomitsch",2021,IEEE Transactions on Human …,46
A survey on autonomous vehicle control in the era of mixed-autonomy: From physics-based to AI-guided driving policy learning,"X Di, R Shi",2021,Transportation research part C: emerging technologies,165
A gender study of communication interfaces between an autonomous car and a pedestrian,CM Chang,2020,12th International Conference on Automotive User …,16
Navigation system for autonomous vehicle: A survey,"M Imad, MA Hassan, H Junaid",2020,Journal of Computer …,7
Autonomous driving: a survey of technological gaps using google scholar and web of science trend analysis,"S Hacohen, O Medina, S Shoval",2022,IEEE Transactions on …,10
"Autonomous buses: Intentions to use, passenger experiences, and suggestions for improvement","K Mouratidis, VC Serrano",2021,… research part F: traffic psychology and …,75
Comprehensive review of data exchange in vehicle-to-pedestrian communications: State of the art,"ZH Kareem, KN bin Ramli, AM Jawad",2021,… of Engineering and …,0
Vulnerable road users and connected autonomous vehicles interaction: A survey,"A Reyes-Muñoz, J Guerrero-Ibáñez",2022,Sensors,22
A survey of vehicle trajectory prediction based on deep learning models,"Manish, U Dohare, S Kumar",2023,Proceedings of Third International …,3
What are social norms for low-speed autonomous vehicle navigation in crowded environments? An online survey,"M Golchoubian, M Ghafurian, NL Azad",2021,Proceedings of the 9th …,3
External human–machine interfaces can be misleading: An examination of trust development and misuse in a CAVE-based pedestrian simulation environment,"AA Kaleefathullah, N Merat, YM Lee",2022,Human …,82
State estimation and motion prediction of vehicles and vulnerable road users for cooperative autonomous driving: A survey,"P Ghorai, A Eskandarian, YK Kim",2022,IEEE transactions on …,57
Autonomous vehicle-pedestrian interaction across cultures: towards designing better external Human Machine Interfaces (eHMIs),"C Ranasinghe, K Holländer, R Currano",2020,Extended abstracts of …,28
"Perspective, survey and trends: Public driving datasets and toolsets for autonomous driving virtual test","P Ji, R Li, Y Xue, Q Dong, L Xiao",2021,2021 IEEE International …,5
Assessing Traffic Characteristics for Safe Pedestrian Crossings: Developing Warrants for Sustainable Urban Safety,"S Chauhan, S Dave, J Shah, A Kedia",2024,Sustainability,0
Sound decisions: How synthetic motor sounds improve autonomous vehicle-pedestrian interactions,"D Moore, R Currano, D Sirkin",2020,12th International Conference on …,34
New urban planning challenges under emerging autonomous mobility: Evaluating backcasting scenarios and policies through an expert survey,"S Nogués, E González-González, R Cordera",2020,Land Use Policy,53
A V2P collision risk warning method based on LSTM in IOV,"R Pan, L Jie, X Zhang, S Pang",2022,Security and …,3
"How simulation helps autonomous driving: A survey of sim2real, digital twins, and parallel intelligence","X Hu, S Li, T Huang, B Tang, R Huai",2023,IEEE Transactions on …,22
Autonomous convoying: A survey on current research and development,"S Nahavandi, S Mohamed, I Hossain",2022,IEEE …,16
Survey of state-of-art autonomous driving technologies with deep learning,"Y Huang, Y Chen",2020,2020 IEEE 20th international conference on …,54
EU long-term dataset with multiple sensors for autonomous driving,"Z Yan, L Sun, T Krajník",2020,2020 IEEE/RSJ …,100
"A survey on autonomous driving datasets: Statistics, annotation quality, and a future outlook","M Liu, E Yurtsever, J Fossaert, X Zhou",2024,IEEE Transactions …,4
A socio-technical model of autonomous vehicle adoption using ranked choice stated preference data,"KE Asmussen, A Mondal, CR Bhat",2020,Transportation Research Part C …,74
Advanced techniques for perception and localization in autonomous driving systems: A survey,"Q Sellat, K Ramasubramanian",2022,Optical Memory and Neural Networks,5
A study on the evaluation method of autonomous emergency vehicle braking for pedestrians test using monocular cameras,"BJ Kim, SB Lee",2020,Applied Sciences,13
Proposals for using the advanced tools of communication between autonomous vehicles and infrastructure in selected cases,"M Zawodny, M Kruszyna",2022,Energies,4
Sharing the road with autonomous vehicles: Perceived safety and regulatory preferences,"GS Nair, CR Bhat",2021,Transportation research part C: emerging technologies,93
"Deep learning for object detection and scene perception in self-driving cars: Survey, challenges, and open issues","A Gupta, A Anpalagan, L Guan, AS Khwaja",2021,Array,409
Gisnet: Graph-based information sharing network for vehicle trajectory prediction,"Z Zhao, H Fang, Z Jin, Q Qiu",2020,2020 International Joint …,43
"It practically drives itself: autonomous vehicle technology, psychological attitudes, and susceptibility to risky driving behaviors","MC Azuma, FB Giordano, SA Stoffregen, LS Klos",2023,Ergonomics,5
Deep inverse reinforcement learning for behavior prediction in autonomous driving: Accurate forecasts of vehicle motion,"T Fernando, S Denman, S Sridharan",2020,IEEE Signal …,59
Autonomous Vehicles in 5G and beyond: A Survey,"S Hakak, TR Gadekallu, PKR Maddikunta",2023,Vehicular …,98
Autonomous driving with deep learning: A survey of state-of-art technologies,"Y Huang, Y Chen",2020,arXiv preprint arXiv:2006.06091,96
A survey on autonomous vehicles simulators.,"LH Meftah, R Braham",2022,Journal of Information Assurance & …,2
CSR: cascade conditional variational auto encoder with socially-aware regression for pedestrian trajectory prediction,"H Zhou, D Ren, X Yang, M Fan, H Huang",2023,Pattern Recognition,8
Towards future pedestrian-vehicle interactions: Introducing theoretically-supported AR prototypes,"W Tabone, YM Lee, N Merat, R Happee",2021,… on Automotive User …,31
Improving the experience in the pedestrian's interaction with an autonomous vehicle: an ergonomic comparison of external HMI,"N Métayer, S Coeugnet",2021,Applied ergonomics,27
Increasing pedestrian safety using external communication of autonomous vehicles for signalling hazards,"M Colley, S Li, E Rukzio",2021,… of the 23rd International Conference on …,20
Will automated vehicles encourage more jaywalking? Results from a stated preference survey,"X Dong, E Guerra, RA Daziano",2024,… research part F: traffic psychology and …,0
A comprehensive survey of LIDAR-based 3D object detection methods with deep learning for autonomous driving,"G Zamanakos, L Tsochatzidis, A Amanatiadis",2021,Computers & …,104
Mixed test environment-based vehicle-in-the-loop validation-a new testing approach for autonomous vehicles,"Y Chen, S Chen, T Xiao, S Zhang",2020,2020 IEEE intelligent …,34
"A survey on autonomous driving datasets: Data statistic, annotation, and outlook","M Liu, E Yurtsever, X Zhou, J Fossaert, Y Cui",2024,arXiv preprint arXiv …,10
Sim2real and digital twins in autonomous driving: A survey,"X Hu, S Li, T Huang, B Tang, L Chen",2023,arXiv preprint arXiv:2305.01263,5
I can see the light: Attacks on autonomous vehicles using invisible lights,"W Wang, Y Yao, X Liu, X Li, P Hao, T Zhu",2021,Proceedings of the 2021 …,42
