Title,Authors,Year,Venue,Citations
FMCW-MIMO radar-based pedestrian trajectory tracking under low-observable environments,"X Fang, J Li, Z Zhang, G Xiao",2022,IEEE Sensors Journal,9
Evaluating Pedestrian Trajectory Prediction Methods for the Application in Autonomous Driving,"N Uhlemann, F Fent, M Lienkamp",2023,arXiv preprint arXiv:2308.05194,2
"Humanizing autonomous vehicle driving: Understanding, modeling and impact assessment","FP Orfanou, EI Vlahogianni, G Yannis",2022,… research part F: traffic …,9
Autonomous vehicle-cyclist interaction: Peril and promise,"M Hou, K Mahadevan, S Somanath, E Sharlin",2020,Proceedings of the …,62
Predicting Pedestrian Crossing Behavior at Unsignalized Mid-Block Crosswalks Using Maximum Entropy Deep Inverse Reinforcement Learning,"Y Wang, Y Niu, W Zhu, W Chen, Q Li",2023,IEEE Transactions on …,0
The adaptability and challenges of autonomous vehicles to pedestrians in urban China,"K Wang, G Li, J Chen, Y Long, T Chen, L Chen",2020,Accident Analysis & …,65
Incorporating driving knowledge in deep learning based vehicle trajectory prediction: A survey,"Z Ding, H Zhao",2023,IEEE Transactions on Intelligent Vehicles,7
A systematic survey of control techniques and applications in connected and automated vehicles,"W Liu, M Hua, Z Deng, Z Meng, Y Huang",2023,IEEE Internet of …,62
External human–machine interfaces for autonomous vehicles from pedestrians' perspective: A survey study,"J Guo, Q Yuan, J Yu, X Chen, W Yu, Q Cheng, W Wang",2022,Sensors,13
Insights and strategies for an autonomous vehicle with a sensor fusion innovation: A fictional outlook,"F Hafeez, UU Sheikh, N Alkhaldi, HZ Al Garni",2020,IEEE …,32
Impact of autonomous vehicles on the car-following behavior of human drivers,"R Zhang, S Masoud, N Masoud",2023,Journal of transportation …,10
A Survey of Deep Learning-Based Multimodal Vehicle Trajectory Prediction Methods,"X Wang, L Zhou, Y Liu",2023,China Conference on Wireless Sensor Networks,0
"Infrastructure requirement for autonomous vehicle integration for future urban and suburban roads–Current practice and a case study of Melbourne, Australia","H Manivasakan, R Kalra, S O'Hern, Y Fang, Y Xi",2021,… Research Part A: Policy …,73
"Pedestrian safety using the Internet of things and sensors: Issues, challenges, and open problems","R Hasan, R Hasan",2022,Future generation computer systems,41
Autonomous vehicle experiments and the city,"R Dowling, P McGuirk",2022,Urban Geography,42
How effective are pedestrian crash prevention systems in improving pedestrian safety? Harnessing large-scale experimental data,"I Mahdinia, AJ Khattak, AM Haque",2022,Accident Analysis & Prevention,16
Intent Prediction of Pedestrians via Integration of Facial Expression and Human 2D Skeleton for Autonomous Car-like Mobile Robots,"X Zhu, W Fu, X Xu",2021,2021 IEEE 16th Conference on Industrial …,1
A survey of collaborative machine learning using 5G vehicular communications,"SV Balkus, H Wang, BD Cornet",2022,… Surveys & Tutorials,72
Stronger family ties vs. less social contact: Use intention of autonomous vehicles in family tourism,"YC Wang, T Kato, YD Lu",2024,Journal of Destination Marketing & Management,0
Impact of autonomous vehicles on discretionary activities: an agent-based model with space–time accessibility constraints,"L Feng, JM Betts, L Kamruzzaman, HL Vu",2024,Transportation,0
eHMI: Review and guidelines for deployment on autonomous vehicles,"J Carmona, C Guindel, F Garcia, A de la Escalera",2021,Sensors,67
Designing wearable augmented reality concepts to support scalability in autonomous vehicle-pedestrian interaction,"TTM Tran, C Parker, Y Wang",2022,Frontiers in Computer …,19
What Drives People's Willingness to Adopt Autonomous Vehicles? A Review of Internal and External Factors,"MM Rahman, JC Thill",2023,Sustainability,7
Interpreting externally expressed intentions of an autonomous vehicle,"M Oidekivi, A Nolte, A Aabloo",2021,2021 14th International …,0
"A Survey of Integrated Simulation Environments for Connected Automated Vehicles: Requirements, Tools, and Architecture","VG Stepanyants, AY Romanov",2023,IEEE Intelligent Transportation …,2
Vehicle trajectory prediction using LSTMs with spatial–temporal attention mechanisms,"L Lin, W Li, H Bi, L Qin",2021,IEEE Intelligent Transportation Systems …,165
Unveiling the lack of scalability in research on external communication of autonomous vehicles,"M Colley, M Walch, E Rukzio",2020,Extended abstracts of the 2020 chi …,53
Autonomous vehicle dataset with real multi-driver scenes and biometric data,"F Rosique, PJ Navarro, L Miller, E Salas",2023,Sensors,4
Crossing the street in front of an autonomous vehicle: An investigation of eye contact between drivengers and vulnerable road users,"A Sahaï, E Labeye, L Caroux, C Lemercier",2022,Frontiers in psychology,6
Towards autonomous vehicles: a survey on cooperative vehicle-infrastructure system,"JI Yangjie, Z Zewei, Y Ziru, Y Huang, Y Zhang",2024,Iscience,0
I see you: A vehicle-pedestrian interaction dataset from traffic surveillance cameras,"H Quispe, J Sumire, P Condori, E Alvarez",2022,arXiv preprint arXiv …,5
Stated preference analysis of autonomous vehicle among bicyclists and pedestrians in Pittsburgh using Bayesian Networks,"D Imanishimwe, A Kumar",2023,Accident Analysis & Prevention,2
Plop: Probabilistic polynomial objects trajectory planning for autonomous driving,"T Buhet, E Wirbel, A Bursuc, X Perrotton",2020,arXiv preprint arXiv:2003.08744,27
Communication between autonomous vehicles and pedestrians: an experimental study using virtual reality,"S Zhanguzhinova, E Mako, A Borsos, ÁP Sándor",2023,Sensors,5
Information or advice? A virtual reality study of message content for road crossing in front of autonomous cars,"É Ah-Tchine, E de Vries",2020,Le travail humain,1
Plop: Probabilistic polynomial objects trajectory prediction for autonomous driving,"T Buhet, E Wirbel, A Bursuc",2021,Conference on Robot …,9
Adversarial Pedestrian Modeling based on Deep Reinforcement Learning Method by Using Collision Momentum,D Chen,2023,NA,0
Autonomous vehicle decision-making and control in complex and unconventional scenarios—a review,"F Sana, NL Azad, K Raahemifar",2023,Machines,9
Improving Mapping and Selection of Low-Speed Autonomous Vehicle Shuttle Routes: A Data-Driven Framework,"BM Staes, RL Bertini, N Menon",2022,Automated People Movers and …,0
"Comparison of vehicle-to-bicyclist and vehicle-to-pedestrian communication feedback module: a study on increasing legibility, public acceptance and trust","M Schmidt-Wolf, D Feil-Seifer",2022,2022 31st IEEE International …,5
Perceptions towards autonomous vehicle acceptance: Information mining from Self-Organizing Maps and Random Forests,"A Ziakopoulos, C Telidou, A Anagnostopoulos",2023,IATSS Research,0
An integrated traffic and vehicle co-simulation testing framework for connected and autonomous vehicles,"Y Shi, Z Liu, Z Wang, J Ye, W Tong",2022,IEEE Intelligent …,17
Suicidal Pedestrian: Generation of safety-critical scenarios for autonomous vehicles,"Y Yang, K Kujanpää, IA Babadi",2023,2023 IEEE 26th …,0
Social interactions for autonomous driving: A review and perspectives,"W Wang, L Wang, C Zhang, C Liu",2022,Foundations and Trends …,97
Where to from here? On the future development of autonomous vehicles from a cognitive systems perspective,"S Mahmoud, E Billing, H Svensson, S Thill",2022,Cognitive Systems Research,8
Application of LargeSpace for Investigating Pedestrians' Behaviors when Interacting with Autonomous Vehicles in Shared Spaces,"A Andrijanto, Z Chen, T Kodama",2022,2022 IEEE Conference …,0
Autonomous Vehicle & Pedestrian Interaction,T Uji,2022,NA,0
HTIM: A Hybrid Deep Learning Approach For Pedestrian Trajectory Imputation,"DK Barua, M Halder, S Shopnil, MM Islam",2024,NA,0
Pedestrian Behavior Maps for Safety Advisories: CHAMP Framework and Real-World Data Analysis,"R Greer, S Desai, L Rakla",2023,2023 IEEE Intelligent …,1
"Passengers' acceptance and perceptions of risk while riding in an automated vehicle on open, public roads","MT Pascale, D Rodwell, P Coughlan, SA Kaye",2021,… research part F: traffic …,16
Learning Pedestrian Actions to Ensure Safe Autonomous Driving,"J Huang, A Gautam, S Saripalli",2023,2023 IEEE Intelligent Vehicles …,2
"High-definition maps: Comprehensive survey, challenges and future perspectives","G Elghazaly, R Frank, S Harvey",2023,IEEE Open Journal of …,19
Fostering Fuzzy Logic in Enhancing Pedestrian Safety: Harnessing Smart Pole Interaction Unit for Autonomous Vehicle-to-Pedestrian Communication and Decision …,"V Chauhan, CM Chang, E Javanmardi, J Nakazato",2023,Electronics,1
Context-aware pedestrian trajectory prediction with multimodal transformer,"H Damirchi, M Greenspan",2023,2023 IEEE International …,3
City readiness for connected and autonomous vehicles: A multi-stakeholder and multi-criteria analysis through analytic hierarchy process,"L Jiang, H Chen, Z Chen",2022,Transport policy,16
A reinforcement learning approach for enacting cautious behaviours in autonomous driving system: Safe speed choice in the interaction with distracted pedestrians,"GPR Papini, A Plebe, M Da Lio",2021,IEEE transactions on …,20
Behavioral intention prediction in driving scenes: A survey,"J Fang, F Wang, J Xue, TS Chua",2024,IEEE Transactions on …,19
The Survey of Self-driving Car Challenges in Smart City Infrastructures,N Kulabukhova,2023,… Conference on Computational Science and Its …,2
Effectiveness of the autonomous braking and evasive steering system OPREVU-AES in simulated vehicle-to-pedestrian collisions,"Á Losada, FJ Páez, F Luque, L Piovano",2023,Vehicles,2
Autonomous Vehicles from another Perspective–A Literature Analysis,L Berek,2023,Interdisciplinary Description of Complex Systems …,0
Social Intelligence for Autonomous Vehicles Interacting With Vulnerable Road Users,"Y Chen, R Tian",2024,IEEE Transactions on Intelligent …,0
"Dynamicmap 2.0: A traffic data management platform leveraging clouds, edges and embedded systems","Y Watanabe, K Sato, H Takada",2020,International Journal of Intelligent …,32
System configuration of Human-in-the-loop Simulation for Level 3 Autonomous Vehicle using IPG CarMaker,"CJ Hong, VR Aparow",2021,… conference on internet of things and …,12
A survey on modeling for behaviors of complex intelligent systems based on generative adversarial networks,"Y Lv, J Duan, X Li",2024,Computer Science Review,0
Key Requirements for Autonomous Micromobility Vehicle Simulators,"L Luttkus, L Mikelsons",2023,2023 IEEE International Conference on …,0
Autonomous Vehicles and Their Impacts on Discretionary Activities,"L Feng, JM Betts, L Kamruzzaman, HL Vu",2024,NA,0
Pedestrians' Understanding of a Fully Autonomous Vehicle's Intent to Stop: Utilizing Video-based Crossing Scenarios,"M Hochman, Y Parmet, T Oron-Gilad",2022,Proceedings of the RSS,2
Research on quantum cognition in autonomous driving,"Q Song, W Wang, W Fu, Y Sun, D Wang, Z Gao",2022,Scientific reports,23
What humanlike errors do autonomous vehicles need to avoid to maximize safety?,"AS Mueller, JB Cicchino, DS Zuby",2020,Journal of safety research,86
Stochastic pedestrian avoidance for autonomous vehicles using hybrid reinforcement learning,"H Li, J Huang, Z Cao, D Yang, Z Zhong",2023,Frontiers of Information …,8
""" It Must Be Gesturing Towards Me"": Gesture-Based Interaction between Autonomous Vehicles and Pedestrians","X Chang, Z Chen, X Dong, Y Cai, T Yan, H Cai",2024,arXiv preprint arXiv …,1
"Smart cities, urban mobility and autonomous vehicles: How different cities needs different sustainable investment strategies","MA Richter, M Hagenmaier, O Bandte, V Parida",2022,… Forecasting and Social …,46
Pedestrian collision avoidance using deep reinforcement learning,"A Rafiei, AO Fasakhodi, F Hajati",2022,International journal of automotive …,10
Review of graph-based hazardous event detection methods for autonomous driving systems,"D Xiao, M Dianati, WG Geiger",2023,IEEE Transactions on …,10
Communication and mobility issues of visually impaired pedestrians with connected autonomous vehicles,"S Azizi Soldouz, MS Hasnine, M Sukhai",2023,Transportation …,0
Relation-based motion prediction using traffic scene graphs,"M Zipfl, F Hertlein, A Rettinger, S Thoma",2022,2022 IEEE 25th …,8
Conceptual model of the automated pedestrian simulation system for unmanned vehicles and ADAS systems testing,"AA Tumanov, AV Zolotov, LO Fedosova",2021,IOP Conference Series …,0
Evaluation of autonomous emergency braking by using a theoretical formula and dual cameras,"BJ Kim, SB Lee",2023,… of the Institution of Mechanical Engineers …,0
On the required movement recognition accuracy in cooperative VRU collision avoidance systems,"M Bachmann, M Morold, K David",2020,IEEE Transactions on …,20
"Champ: Crowdsourced, history-based advisory of mapped pedestrians for safer driver assistance systems","R Greer, L Rakla, S Desai, A Alofi",2023,arXiv preprint arXiv …,3
High-Definition Maps Construction Based on Visual Sensor: A Comprehensive Survey,"X Tang, K Jiang, M Yang, Z Liu, P Jia",2023,IEEE Transactions …,3
A New Methodology for Analysing Interactions between an Autonomous Vehicle and other Users,"JMR Velázquez, PH Salmane",2023,2023 IEEE 13th …,0
"How should external Human-Machine Interfaces behave? Examining the effects of colour, position, message, activation distance, vehicle yielding, and visual …","P Bazilinskyy, L Kooijman, D Dodou, JCF De Winter",2021,Applied ergonomics,50
Autonomous Vehicle Decision Making and Urban Infrastructure Optimization,"G Mudrak, SK Semwal",2021,Intelligent Computing: Proceedings of the 2021 …,1
Forecasting the effects of autonomous vehicles on land use,"R Bridgelall, E Stubbing",2021,Technological Forecasting and Social Change,30
A Survey on the Use of Container Technologies in Autonomous Driving and the Case of BeIntelli,"B Acar, MG Augusto, M Sterling",2023,IEEE Open Journal …,0
Predictive trajectory planning for autonomous vehicles at intersections using reinforcement learning,"E Zhang, R Zhang, N Masoud",2023,Transportation Research Part C: Emerging …,14
Deep learning-based pedestrian detection in autonomous vehicles: Substantial issues and challenges,"S Iftikhar, Z Zhang, M Asim, A Muthanna",2022,Electronics,51
Simulation Framework for Testing Autonomous Vehicles in a School for the Blind Campus,"K Kalidas, SY Gelbal, BA Guvenc",2021,NA,1
Agent-based models for simulating e-scooter sharing services: A review and a qualitative assessment,"PG Tzouras, L Mitropoulos, E Stavropoulou",2023,International Journal of …,28
Involvement of Deep Learning for Vision Sensor-Based Autonomous Driving Control: A Review,"A Khanum, CY Lee, CS Yang",2023,IEEE Sensors Journal,5
A case study of unavoidable accidents of autonomous vehicles,"Z Sun, M Lin, W Chen, B Dai, P Ying",2024,Traffic injury …,1
A corridor-level pedestrian crash risk assessment framework using autonomous vehicle sensor data,S Singh,2023,NA,0
Computer Vision Based Sensor System for Autonomous Vehicles,"M Gorobetz, AB Srinivasa",2021,TRANSPORT MEANS 2021,0
Substituting individual mobility by mobility on demand using autonomous vehicles-a sustainable assessment simulation of Berlin and Stuttgart,"G Fournier, A Boos, R Wörner",2020,International …,18
Multimodal Data Trajectory Prediction: A Review,"X Wang, H Yue, Q Yang",2023,2023 IEEE 10th International …,1
Control-aware prediction objectives for autonomous driving,"R McAllister, B Wulfe, J Mercat, L Ellis",2022,… on Robotics and …,22
Image-based automatic traffic lights detection system for autonomous cars: a review,"S Gautam, A Kumar",2023,Multimedia Tools and Applications,10
Adaptive road configurations for improved autonomous vehicle-pedestrian interactions using reinforcement learning,"Q Ye, Y Feng, JJE Macias, M Stettler",2022,IEEE transactions on …,1
Computer and Information Sciences,"BB Elallid, N Benamar, AS Hafid, T Rachidi, N Mrani",2022,NA,0
A software architecture for autonomous vehicles: Team lrm-b entry in the first carla autonomous driving challenge,"LA Rosero, IP Gomes, JAR da Silva, TC Santos",2020,arXiv preprint arXiv …,8
Language of driving for autonomous vehicles,"K Kalda, SL Pizzagalli, RM Soe, R Sell, M Bellone",2022,Applied Sciences,3
Pedestrian safety in an automated driving environment: Calibrating and evaluating the responsibility-sensitive safety model,"X Wang, C Ye, M Quddus, A Morris",2023,Accident Analysis & Prevention,4
From traffic sensor data to semantic traffic descriptions: The test area autonomous driving baden-württemberg dataset (taf-bw dataset),"M Zipfl, T Fleck, MR Zofka",2020,2020 IEEE 23rd …,17
A learning-based vehicle trajectory-tracking approach for autonomous vehicles with lidar failure under various lighting conditions,"M Cao, R Wang, N Chen, J Wang",2021,IEEE/ASME transactions on …,13
To Cross or Not-to-Cross: A Robotic Object for Mediating Interactions Between Autonomous Vehicles and Pedestrians,"SC Kumaran, A Oberlender, A Grishko",2023,2023 32nd IEEE …,2
Role of 5G in vehicular network for smart vehicles in smart cities,"G Suciu, I Hussain, IA Esanu",2021,2021 IEEE 27th …,3
CISCAV: Consensus-based intersection scheduling for connected autonomous vehicles,"E Regnath, M Birkner",2021,2021 IEEE International …,3
Is attention to bounding boxes all you need for pedestrian action prediction?,"L Achaji, J Moreau, T Fouqueray",2022,2022 IEEE Intelligent …,28
HAVIT: A VR-Based Platform to Support Human-Autonomous Vehicle Interaction Study,"X Guo, D Wan, D Liu, C Mousas, Y Chen",2022,International Conference on …,1
Road: The road event awareness dataset for autonomous driving,"G Singh, S Akrigg, M Di Maio, V Fontana",2022,IEEE transactions on …,74
Introducing autonomous buses into street functional classification systems: An exploratory spatial approach,"S Tsigdinos, C Karolemeas, E Bakogiannis",2021,Case studies on transport …,20
Autonomous vehicles drive into shared spaces: ehmi design concept focusing on vulnerable road users,"Y Li, H Cheng, Z Zeng, H Liu",2021,2021 IEEE International …,34
Predicting the intention of distracted pedestrians at road crossings,"AL O'Dell, AJ Filtness, AP Morris",2022,Accident Analysis & Prevention,12
Towards A Real-Time Emergency Response Model For Connected And Autonomous Vehicles.,"YH Liu, O de Paula Albuquerque, PCK Hung",2022,CIKM …,1
CAR--Cityscapes Attributes Recognition A Multi-category Attributes Dataset for Autonomous Vehicles,"K Metwaly, A Kim, E Branson, V Monga",2021,arXiv preprint arXiv:2111.08243,3
Autonomous vehicles: an analysis both on their distinctiveness and the potential impact on urban transport systems,"A Severino, S Curto, S Barberi, F Arena, G Pau",2021,Applied Sciences,42
How much do you trust your self-driving car? exploring human-robot trust in high-risk scenarios,"J Xu, A Howard",2020,"… on Systems, Man, and Cybernetics (SMC)",13
Efficiency and Safety Evaluation of Left-turn Vehicles and Crossing Pedestrians in Signalized Intersections under the Autonomous Vehicle Mixed Flow Condition,"A Pan, X Zhang, M Iryo-Asano, H Nakamura",2022,International Journal of …,0
Trajectory prediction using equivariant continuous convolution,"R Walters, J Li, R Yu",2020,arXiv preprint arXiv:2010.11344,51
A survey on robustness in trajectory prediction for autonomous vehicles,"J Hagenus, FB Mathiesen, JF Schumann",2024,arXiv preprint arXiv …,0
Comparison of Simulators based on Scenario-based Testing of Autonomous Vehicles,"VR Nalawade, M Kumar, AS Bhandari",2022,… Conference on Smart …,0
Envisioning Autonomy,G Martin,2022,NA,0
Location-based schemes for mitigating cyber threats on connected and automated vehicles: a survey and design framework,"D Suo, J Moore, M Boesch, K Post",2020,IEEE transactions on …,19
Vulnerable Road User Safety Using Mobile Phones with Vehicle-to-VRU Communication,"SY Gelbal, B Aksun-Guvenc, L Guvenc",2024,Electronics,1
Gamma: A general agent motion model for autonomous driving,"Y Luo, P Cai, Y Lee, D Hsu",2022,IEEE Robotics and Automation …,40
Simulating crowds and autonomous vehicles,"J Charlton, LRM Gonzalez, S Maddock",2020,… Science XXXVII: Special …,12
Learning to Estimate Multivariate Uncertainty in Deep Pedestrian Trajectory Prediction,"AR Castro, V Grassi",2023,"… on Robotics (SBR), and 2023 Workshop …",0
Active Obstacle Avoidance Trajectory Planning for Vehicles Based on Obstacle Potential Field and MPC in V2P Scenario,"R Pan, L Jie, X Zhao, H Wang, J Yang, J Song",2023,Sensors,7
CIPF: Crossing intention prediction network based on feature fusion modules for improving pedestrian safety,"JS Ham, DH Kim, NK Jung",2023,Proceedings of the IEEE …,7
Immediate vehicle movement estimation and 3D reconstruction for Mono cameras by utilizing epipolar geometry and direction prior,"Z Rozsa, M Golarits, T Sziranyi",2022,IEEE Transactions on …,5
Trajectory planning approach for autonomous electric bus in dynamic environment,"A Waleed, S Hammad, M Abdelaziz",2023,Proceedings of the …,0
Effectiveness of the Autonomous Braking and Evasive Steering System OPREVU-AES in Real World Vehicle-to-pedestrian collisions,"Á Losada, FJ Páez, F Luque, L Piovano",2022,NA,0
A seamless navigation system and applications for autonomous vehicles using a tightly coupled GNSS/UWB/INS/map integration scheme,"C Wang, A Xu, X Sui, Y Hao, Z Shi, Z Chen",2021,Remote Sensing,16
Application of Hybrid Deep Reinforcement Learning for Managing Connected Cars at Pedestrian Crossings: Challenges and Research Directions,"A Brunoud, A Lombard, N Gaud, A Abbas-Turki",2024,Future Transportation,0
Vehicular applications of koopman operator theory—a survey,"WA Manzoor, S Rawashdeh, A Mohammadi",2023,IEEE Access,7
A highly accurate positioning solution for C-V2X systems,"Q Liu, P Liang, J Xia, T Wang, M Song, X Xu, J Zhang",2021,Sensors,23
A Method for Evaluating the Complexity of Autonomous Driving Road Scenes,"H Ni, J Wu",2024,NA,0
MPC-PF: Social interaction aware trajectory prediction of dynamic objects for autonomous driving using potential fields,"NP Bhatt, A Khajepour",2022,2022 IEEE/RSJ …,4
Mobile Safety Application for Pedestrians Utilizing P2V Communication over Bluetooth,"SY Gelbal, MR Cantas, BA Guvenc, L Guvenc",2022,NA,6
Paracosm: A Test Framework for Autonomous Driving Simulations,"R Majumdar, A Mathur, M Pirron",2021,International …,34
Routing and scheduling of intelligent autonomous vehicles in industrial logistics systems,"SS Abosuliman, AO Almagrabi",2021,Soft Computing,34
A Shared Low-Speed Light-Weight Autonomous Mobility (SLLAM) System for Campus Environments,Z Zhang,2023,NA,0
A Social Approach for Autonomous Vehicles: A Robotic Object to Enhance Passengers' Sense of Safety and Trust,"S Chakravarthi Kumaran, T Bechor, H Erel",2024,Proceedings of the 2024 …,0
Evolution of traffic microsimulation and its use for modeling connected and automated vehicles,"N Raju, H Farah",2021,Journal of Advanced Transportation,40
A Systematic literature review of autonomous and connected vehicles in traffic management,F Alanazi,2023,Applied Sciences,22
Multimodal deep generative models for trajectory prediction: A conditional variational autoencoder approach,"B Ivanovic, K Leung, E Schmerling",2020,IEEE Robotics and …,103
"Advances, Opportunities and Challenges in AI-enabled Technologies for Autonomous and Connected Vehicles","YL Murphey, I Kolmanovsky, P Watta",2022,… Technologies for Autonomous and …,1
Implementation of ADAS and Autonomy on UNLV Campus,Z Rahman,2023,NA,0
Social Interaction‐Aware Dynamical Models and Decision‐Making for Autonomous Vehicles,"L Crosato, K Tian, HPH Shum, ESL Ho",2024,Advanced Intelligent …,7
Deep encoder–decoder-NN: A deep learning-based autonomous vehicle trajectory prediction and correction model,"F Hui, C Wei, W ShangGuan, R Ando, S Fang",2022,Physica A: Statistical …,22
Crossfusor: A Cross-Attention Transformer Enhanced Conditional Diffusion Model for Car-Following Trajectory Prediction,"J You, H Shi, K Wu, K Long, S Fu, S Chen",2024,arXiv preprint arXiv …,0
Unsupervised pedestrian pose prediction: A deep predictive coding network-based approach for autonomous vehicle perception,"X Du, R Vasudevan",2020,IEEE Robotics & …,5
Save the Smombies: App-assisted street crossing,"K Holländer, A Krüger, A Butz",2020,22nd International Conference on …,26
A survey on data-driven scenario generation for automated vehicle testing,"J Cai, W Deng, H Guang, Y Wang, J Li, J Ding",2022,Machines,30
Don't go that way! risk-aware decision making for autonomous vehicles,"K Mokhtari, KA Lang, AR Wagner",2020,"… 2020, Golden, CO, USA, November 14 …",4
LSTM-based prediction method of surrounding vehicle trajectory,"K Wang, Y Qian, T An, Z Zhang",2022,… Conference on Artificial …,4
Autonomous Vehicle Dataset with Real Multi-Driver Scenes and Biometric Data,"MF Rosique Contreras, PJ Navarro Lorente, LR Miller",2023,NA,0
Hybrid autonomous driving guidance strategy combining deep reinforcement learning and expert system,"Y Fu, C Li, FR Yu, TH Luan",2021,IEEE Transactions on …,29
MPC-PF: Socially and spatially aware object trajectory prediction for autonomous driving systems using potential fields,"NP Bhatt, A Khajepour",2023,IEEE Transactions on …,14
Analysis of the Interaction between Humans and Autonomous Vehicles Equipped with External Human–Machine Interfaces: The Effect of an Experimental Reward …,"R Almeida, E Sousa, D Machado, F Pereira, S Faria",2024,Sustainability,0
From senses to sensors: autonomous cars and probing what machine learning does to mobilities studies,"D Mukhtar-Landgren, A Paulsson",2023,Distinktion: Journal of Social …,0
An end-to-end curriculum learning approach for autonomous driving scenarios,"L Anzalone, P Barra, S Barra",2022,IEEE Transactions …,25
