Title,Authors,Year,Venue,Citations
Deep learning for vision-based prediction: A survey,A Rasouli,2020,arXiv preprint arXiv:2007.00095,52
Deer in the headlights: FIR-based Future Trajectory Prediction in Nighttime Autonomous Driving,"A Rahimpour, N Fallahinia",2023,2023 IEEE Intelligent …,0
Collaborative Decision-Making Using Spatiotemporal Graphs in Connected Autonomy,"P Gao, Y Shen, MC Lin",2023,arXiv preprint arXiv:2310.20491,0
"Use of smartphones for ensuring vulnerable road user safety through path prediction and early warning: An in-depth review of capabilities, limitations and their …","I Vourgidis, L Maglaras, AS Alfakeeh, AH Al-Bayatti",2020,Sensors,29
Augmented reality interfaces for pedestrian-vehicle interactions: An online study,"W Tabone, R Happee, J García, YM Lee",2022,Unpublished …,5
Someone to watch over you: using Bluetooth beacons for alerting distracted pedestrians,"R Hasan, MA Hoque, Y Karim, R Griffin",2022,IEEE internet of …,4
Pedestrian traffic light control with crosswalk FMCW radar and group tracking algorithm,"P Nimac, A Krpič, B Batagelj, A Gams",2022,Sensors,5
Pushing ROS towards the dark side: a ROS-based Co-simulation architecture for mixed-reality test systems for autonomous vehicles,"MR Zofka, L Töttel, M Zipfl, M Heinrich",2020,… and Integration for …,16
A Collision Avoidance Strategy Based on Entropy-Increasing Risk Perception in a Vehicle–Pedestrian-Integrated Reaction Space,"Y Ding, W Zhang, X Wu, J Xu, J Gong",2024,World Electric Vehicle Journal,0
AI-powered in-vehicle passenger monitoring using low-cost mm-wave radar,"H Abedi, S Luo, V Mazumdar, MMYR Riad",2021,IEEE …,31
A systematic survey on big data and artificial intelligence algorithms for intelligent transportation system,"S Abirami, M Pethuraj, M Uthayakumar",2024,Case Studies on Transport …,0
ADD: An automatic desensitization fisheye dataset for autonomous driving,"Z Wu, X Chen, H Wei, F Song, T Xu",2023,Engineering Applications of Artificial …,3
Development of Complex Scenarios and Control Algorithms for Autonomous Driving Functions (ADFs) in a Driving Simulator,M Batmaz,2024,NA,0
Vehicle automation–other road user communication and coordination: Theory and mechanisms,"JE Domeyer, JD Lee, H Toyoda",2020,IEEE Access,57
Looking ahead: Anticipating pedestrians crossing with future frames prediction,"M Chaabane, A Trabelsi",2020,Proceedings of the …,59
Realization of Safe Autonomous Driving using Randomized Model Predictive Control,A Muraleedharan,2023,NA,0
A comprehensive review on autonomous navigation,"S Nahavandi, R Alizadehsani, D Nahavandi",2022,arXiv preprint arXiv …,15
Integration of wearables and wireless technologies to improve the interaction between disabled vulnerable road users and self-driving cars,"A Guerrero-Ibañez, I Amezcua-Valdovinos",2023,Electronics,3
A Social Approach for Autonomous Vehicles: A Robotic Object to Enhance Passengers' Sense of Safety and Trust,"S Chakravarthi, T Bechor, H Erel",2024,NA,0
Discovering the Design Challenges of Autonomous Vehicles through Exploring Scenarios via an Immersive Design Workshop,"J Lee, W Park, S Lee",2021,Proceedings of the 2021 ACM Designing …,4
CO2 Emissions Induced by Vehicles Cruising for Empty Parking Spaces in an Open Parking Lot,"V Paidi, J Håkansson, H Fleyeh, RG Nyberg",2022,Sustainability,19
Recent trends in pedestrian detection for robotic vision using deep learning techniques,"S Mishra, S Jabin",2021,Artificial intelligence for future generation robotics,12
Intelligent Transportation,"RST Lee, RST Lee",2020,Artificial Intelligence in Daily Life,1
"Human factors, artificial intelligence and autonomous cars: Perspectives for a complex implementation","SB Pereira, RD Botelho",2021,NA,1
Performance evaluation of VANET routing protocols in Madinah city,"MAR Abdeen, A Beg, SM Mostafa, AA AbdulGhaffar",2022,Electronics,24
"Unfreezing autonomous vehicles with game theory, proxemics, and trust","F Camara, C Fox",2022,Frontiers in Computer Science,1
Directional primitives for uncertainty-aware motion estimation in urban environments,"R Senanayake, M Toyungyernsub",2020,2020 IEEE 23rd …,5
Vehicle Maneuver Prediction using Deep Learning Networks,S Wang,2023,NA,0
Raspberry Pi and Arduino Based Autonomous Car,"L UJWAL, KS Nandini",2020,IJRDO-Journal of Electrical And Electronics …,0
Impact of ground truth annotation quality on performance of semantic image segmentation of traffic conditions,"V Taran, Y Gordienko, A Rokovyi, O Alienin",2020,Advances in Computer …,21
"Towards autonomous driving in dense, heterogeneous, and unstructured traffic",R Chandra,2022,NA,8
Federated learning for connected and automated vehicles: A survey of existing approaches and challenges,"VP Chellapandi, L Yuan, CG Brinton",2023,IEEE Transactions …,21
Vehicle Trajectory Prediction by Knowledge‐Driven LSTM Network in Urban Environments,"S Wang, P Zhao, B Yu, W Huang",2020,Journal of Advanced …,23
Supervision of a self-driving vehicle unmasks latent sleepiness relative to manually controlled driving,"EE Flynn-Evans, LR Wong, Y Kuriyagawa, N Gowda",2021,Scientific reports,10
Learning to interpret novel eHMI: The effect of vehicle kinematics and eHMI familiarity on pedestrian'crossing behavior,"YM Lee, R Madigan, C Uzondu, J Garcia",2022,Journal of safety …,78
A Literature Review of Current Practices to Evaluate the Usability of External Human Machine Interface,"Y Zheng, K Wu, R Shi, X Zhu, J Zhang",2023,International Conference on …,0
REDUCTION IN ENTRY CAPACITY OF ROUNDABOUT UNDER THE INFLUENCE OF PEDESTRIANS IN MIXED TRAFFIC CONDITIONS.,"C Bari, A Dhamaniya",2022,Komunikácie,0
Modeling Interactions of Autonomous/Manual Vehicles and Pedestrians with a Multi-Agent Deep Deterministic Policy Gradient,"W Hu, H Mu, Y Chen, Y Liu, X Li",2023,Sustainability,0
Pedestrian crash risk analysis using extreme value models: new insights and evidence,"A Ankunda, Y Ali, M Mohanty",2024,Accident Analysis & Prevention,1
Robotic Vehicles: Systems and Technology,TS Ng,2021,NA,3
Trajectory prediction neural network and model interpretation based on temporal pattern attention,"H Hu, Q Wang, M Cheng, Z Gao",2022,IEEE Transactions on …,7
A multi-modal vehicle trajectory prediction framework via conditional diffusion model: A coarse-to-fine approach,"Z Li, H Liang, H Wang, X Zheng, J Wang",2023,Knowledge-Based …,5
Designing accountable systems,"S Kacianka, A Pretschner",2021,Proceedings of the 2021 ACM conference on …,29
QoI-oriented incentive mechanisms for vehicle-based visual crowdsourcing,R Pires Orozco,2021,NA,0
Summarizing vehicle driving decision-making methods on vulnerable road user collision avoidance,"Q Yuan, Y Gao, J Zhu, H Xiong, Q Xu",2023,Digital Transportation …,0
Autonomous vehicles and vulnerable road-users—important considerations and requirements based on crash data from two countries,"AP Morris, N Haworth, A Filtness, DPA Nguatem",2021,Behavioral …,15
A Review of Decision-Making and Planning for Autonomous Vehicles in Intersection Environments,"S Chen, X Hu, J Zhao, R Wang, M Qiao",2024,World Electric Vehicle Journal,2
Calibration of trust in autonomous vehicle,"SC Lee, YG Ji",2022,Human-Automation Interaction: Transportation,2
Study of overtaking method of intelligent vehicle under vehicle road coordination,"Y Wang, K Yin",2021,Journal of Physics: Conference Series,4
Intelligent Traffic Light System using Deep Reinforcement Learning,"R Yauri, F Silva, A Huaccho, O Llerena",2023,WSEAS Transactions on …,0
Cooperative Infrastructure Perception,"F Ahmad, C Shin, W Pang, J Cashman",2024,Proceedings of the …,1
"Unravelling the last-mile conundrum: A comparative study of autonomous delivery robots, delivery bicycles, and light commercial vehicles in 14 varied European …","A Garus, P Christidis, A Mourtzouchou, L Duboz",2024,Sustainable Cities and …,0
Self-Driving Cars-The Future Is Already in Texas but the Laws Are Not: An Analysis of Potential Changes to Statutory and Common Laws with Integration of …,LMN Contreras,2020,Hous. Bus. & Tax LJ,0
Computer vision applications in intelligent transportation systems: a survey,"E Dilek, M Dener",2023,Sensors,28
Blockage effects of road bridge on mmwave channels for intelligent autonomous vehicles,"D Yan, K Guan, D He, J Kim, H Chung",2023,IEEE Transactions …,8
Advance generalization technique through 3D CNN to overcome the false positives pedestrian in autonomous vehicles,"S Iftikhar, M Asim, Z Zhang, AAA El-Latif",2022,Telecommunication Systems,15
Vulnerable Road User Detection and Safety Enhancement: A Comprehensive Survey,"RM Silva, GF Azevedo, MVV Berto, JR Rocha",2024,arXiv preprint arXiv …,0
Drivers' Attitudes and Perceptions towards A Driving Automation System with Augmented Reality Human-Machine Interfaces,"X Wu, C Merenda, T Misu, K Tanous",2020,2020 IEEE Intelligent …,17
""" What's That Robot Doing Here?"": Perceptions Of Incidental Encounters With Autonomous Quadruped Robots","E Hauser, YC Chan, P Chonkar, G Hemkumar",2023,… Autonomous Systems,8
Human awareness versus Autonomous Vehicles view: comparison of reaction times during emergencies,"A Rydzewski, P Czarnul",2021,2021 IEEE Intelligent Vehicles …,4
HiVeGPT: Human-machine-augmented intelligent vehicles with generative pre-trained transformer,"J Zhang, J Pu, J Xue, M Yang, X Xu",2023,IEEE Transactions …,48
Mobile Safety Application for Pedestrians,"SY Gelbal, MR Cantas, BA Guvenc, L Guvenc",2023,arXiv preprint arXiv …,1
"Simulation Platforms for Autonomous Driving and Smart Mobility: Simulation Platforms, Concepts, Software, APIs","L Creutz, S Kopp, J Schneider, M Dziubany",2021,Smart …,1
Reinforcement Learning-based Autonomous Parking with Expert Demonstrations,"Y Wu, L Wang, X Lu, Y Wu",2023,2023 7th CAA …,0
"Impact of the COVID-19 pandemic on daily travel: Findings from New South Wales, Australia","B Du, C Zhang, T Qu, Q Wang, QS Zhou, T Cui",2024,Travel Behaviour and …,1
Analysis of pedestrian stress level using GSR sensor in virtual immersive reality,"M Mudassar, A Kalatian, B Farooq",2021,arXiv preprint arXiv:2111.11492,12
A multi-task learning network with a collision-aware graph transformer for traffic-agents trajectory prediction,"B Yang, F Fan, R Ni, H Wang",2024,IEEE Transactions …,4
A technical review on driverless vehicle technologies in smart cities,"Y Zhu, R Jiang, Q Ni",2022,Big Data Privacy and Security in Smart Cities,1
Digital twins based VR simulation for accident prevention of intelligent vehicle,"Z Lv, J Guo, AK Singh, H Lv",2022,IEEE Transactions on Vehicular …,17
"Instruction or intention? Investigating eHMIs' intuitiveness as allocentric or egocentric messages for different light animations, road priorities and vehicle behaviours","E Fratini, R Welsh, P Thomas",2021,NA,3
Using latent class clustering and binary logistic regression to model Australian cyclist injury severity in motor vehicle–bicycle crashes,"SA Samerei, K Aghabayk, N Shiwakoti",2021,Journal of safety …,38
A study on testing autonomous driving systems,"X Zhang, Y Cai, Z Yang",2020,2020 IEEE 20th International …,6
Design of IoT-Based Device-to-Vehicle Communication Message Data Sets for Wireless Information Provision in Autonomous Highway Environment,"Y Cho, J Kim, JT Kim",2021,Journal of Korean Society of Transportation,2
External human–machine interfaces: Gimmick or necessity?,"J de Winter, D Dodou",2022,Transportation research interdisciplinary …,39
A survey on socially aware robot navigation: Taxonomy and future challenges,"PT Singamaneni, P Bachiller-Burgos",2024,… Journal of Robotics …,7
Kernelized convolutional transformer network based driver behavior estimation for conflict resolution at unsignalized roundabout,"O Sharma, NC Sahoo, NB Puhan",2023,ISA transactions,13
A review of safety test methods for new car assessment program in Southeast Asian countries,"SNA Halimi, ST Rasmana, D Adiputra, WJ Yahya",2023,Open …,0
Autonomous Vehicles Using OpenCV and Python With Wireless Charging,"N Raghu, VN Trupti, C Badachi",2023,… in Electric Vehicle …,0
Autonomous Driving Vision Accuracy Modeling with Neural Networks,"J Zhou, J Liu",2024,2024 International Conference on Inventive …,0
The future urban road: A systematic literature review-enhanced Q-method study with experts,"S Tsigdinos, PG Tzouras, E Bakogiannis",2022,… Research Part D …,47
Demands of Autonomous Vehicles on Urban Infrastructure: A Study of required transformations and global adaptability to AVs,"A Waqas, E Shishore",2021,NA,0
5g-enabled v2x communications for vulnerable road users safety applications: a review,"C Zoghlami, R Kacimi, R Dhaou",2023,Wireless Networks,26
Joint prediction of next location and travel time from urban vehicle trajectories using long short-term memory neural networks,"J Sun, J Kim",2021,Transportation Research Part C: Emerging …,65
Efficient gemm implementation for vision-based object detection in autonomous driving applications,"FZ Guerrouj, S Rodríguez Flórez, M Abouzahir",2023,Journal of Low Power …,1
"IntPred: Flexible, fast, and accurate object detection for autonomous driving systems","H Tabani, M Fusi, L Kosmidis, J Abella",2020,Proceedings of the 35th …,5
Passenger opinions of the perceived safety and interaction with automated shuttles: A test ride study with 'hidden'safety steward,"S Nordhoff, J Stapel, B van Arem, R Happee",2020,Transportation research part …,62
GIVA: Interaction-aware trajectory prediction based on GRU-Improved VGG-Attention Mechanism model for autonomous vehicles,"Z Meng, R He, J Wu, S Zhang",2023,Proceedings of the …,0
IoT technologies for connected and automated driving applications,"O Vermesan, R Bahr, M Falcitelli, D Brevi",2022,Internet of Things …,15
"The Why, When, and How to Use Active Learning in Large-Data-Driven 3D Object Detection for Safe Autonomous Driving: An Empirical Exploration","R Greer, B Antoniussen, MV Andersen",2024,arXiv preprint arXiv …,5
Designing airspace for urban air mobility: A review of concepts and approaches,"A Bauranov, J Rakas",2021,Progress in Aerospace Sciences,253
Sequential semantic segmentation of road profiles for path and speed planning,"G Cheng, JY Zheng",2022,IEEE Transactions on Intelligent …,6
A review of research on traffic conflicts based on intelligent vehicles,"L Hu, J Ou, J Huang, Y Chen, D Cao",2020,Ieee Access,88
GeFL: Gradient Encryption-Aided Privacy Preserved Federated Learning for Autonomous Vehicles,"R Parekh, N Patel, R Gupta, NK Jadav, S Tanwar",2023,IEEE …,16
Path Tracking and Obstacle Avoidance Control Using Deep Reinforcement Learning for Autonomous Vehicles,"F Shafique, T Naeem",2023,2023 17th International …,0
Prediction of Social Dynamic Agents and Long-Tailed Learning Challenges: A Survey,"D Thuremella, L Kunze",2023,Journal of Artificial Intelligence Research,0
Enhanced Scene Understanding and Situation Awareness for Autonomous Vehicles Based on Semantic Segmentation,"Y Zhao, L Wang, X Yun, C Chai, Z Liu",2024,"… on Systems, Man …",0
Vehicle automation software development using software-only simulation,A Ruusiala,2022,NA,1
Intelligent traffic light system using deep reinforcement learning,"R Yauri Rodríguez, F Silva, A Huaccho, O Llerena",2023,NA,0
Autonorama: the illusory promise of high-tech driving,P Norton,2021,NA,22
Impacts of highly automated vehicles on travel demand: macroscopic modeling methods and some results,"J Sonnleitner, M Friedrich, E Richter",2022,Transportation,19
Outdoor Traffic Scene Risk Estimation in the Context of Autonomous Driving,"RD Brehar, RO Băbuţ, A Fuzes",2022,2022 IEEE 18th …,0
Formalizing Human Machine Communication in the Context of Autonomous Vehicles,"S Gopalswamy, S Saripalli, D Shell, JS Hickman",2020,NA,0
Visual Perception System for Autonomous Driving,"Q Zhang, S Gou, W Li",2023,arXiv preprint arXiv:2303.02257,0
"Relating emotions, psychophysiological indicators and context in public transport trips: Case study and a joint framework for data collection and analysis","C Barría, CA Guevara, A Jimenez-Molina",2023,… Research Part F: Traffic …,6
Traffic object detection and recognition based on the attentional visual field of drivers,"M Shirpour, N Khairdoost, MA Bauer",2021,IEEE Transactions …,30
EXPLORING THE USE OF ARTIFICIAL INTELLIGENCE TO SOLVE TRAFFIC CONGESTION,J Hu,2020,European journal of economics and management …,1
"Using Safety Performance Models, Autonomous Vehicle Data, and Machine Learning to Develop Contextual Complexity Criteria to Establish a Standardized Process …",V Bendigeri,2022,NA,1
A comprehensive study on the impact of artificial intelligence in autonomous vehicles,"A Balasundaram, MR Prusty",2022,2022 International Virtual …,1
A V2P Warning System on the Basis of LoRa Wireless Network,"R Pan, L Jie, H Wang, P Jie",2023,2023 5th International …,0
… of COVID-19 on the transport sector and measures as well as recommendations of policies and future research: Analyses based on a world-wide expert survey,"J Zhang, Y Hayashi",2020,Available at SSRN,34
Federated Semi-Supervised Learning for Object Detection in Autonomous Driving,"F Chi, Y Wang, P Nasiopoulos",2023,ICASSP 2023-2023 …,2
Vehicle to everything (v2x) communication protocol by using vehicular ad-hoc network,"MA Naeem, X Jia, MA Saleem, W Akbar",2020,… on Wavelet Active …,6
Scenario Generation and Simulation for Autonomous Software Validation,P Cao,2023,NA,0
Review of Artificial Intelligence-Integrated Blockchain for Training Autonomous Vehicles,"A Kumar, N Sharma",2023,2023 International Conference on …,0
"Factores humanos, inteligencia artificial y autos autónomos: Perspectivas para una implementación compleja","SB Pereira, RD Botelho",2021,Revista de Ciencia y Tecnología,0
Dynamic road management in the era of cav,"M Younis, S Lee, W Lalouani, D Tan",2020,… and Autonomous …,6
Study the effect of communication delay for perception and collision avoidance in cooperative autonomous driving,"P Ghorai, A Eskandarian",2020,ASME …,3
Traffic light timer adjustment system using threshold edge detection for image processing: A software engineering approach,F Kedwan,2023,International Journal of Current Research in …,3
Object Tracking Using Computer Vision: A Review,"P Kadam, G Fang, JJ Zou",2024,Computers,0
Interaction between pedestrians and autonomous vehicles: protocol analysis and preliminary results,"R Almeida, E Sousa, D Machado, E Freitas",2023,Transportation research …,0
How Far Ahead Should Autonomous Vehicles Start Resolving Predicted Conflicts? Exploring Uncertainty-Based Safety-Efficiency Trade-Off,"G Li, Z Li, VL Knoop",2024,IEEE Transactions on …,0
"Ghost on the Windshield: Employing a Virtual Human Character to Communicate Pedestrian Acknowledgement and Vehicle Intention. Information 2022, 13, 420","A Rouchitsas, H Alm",2022,NA,1
Determination of braking diagrams for vehicles of different body types,"D Beșliu, P Vrabie, D Trușcă, T Ioniță, A Radu",2023,NA,0
Trust and distrust of automated parking in a Tesla Model X,"NL Tenhundfeld, EJ de Visser, AJ Ries",2020,Human …,81
Aware and Intelligent Infrastructure for Action Intention Recognition of Cars and Bicycles.,C Englund,2020,VEHITS,3
Exploration of an integrated automated public transportation system,"S Sun, YD Wong, X Liu, A Rau",2020,Transportation Research Interdisciplinary …,11
SLAM–DATMO Method for an Autonomous Vehicles,V Vasudevan,2021,NA,0
"V2X-Equipped Smart Intersections− Survey of Surveys, Use Cases, and Deployments","H Hejazi, L Bokor",2023,Journal of Communications,2
Developing and testing robust autonomy: The university of sydney campus data set,"W Zhou, JS Berrio, C De Alvis, M Shan",2020,IEEE Intelligent …,24
Intelligent transportation systems (ITS): A systematic review using a Natural Language Processing (NLP) approach,TD Putri,2021,Heliyon,26
Parking Facility Location and User Pricing in the Era of Autonomous Vehicle Operations,MT Tabesh,2020,NA,2
A field study on pedestrians' thoughts toward a car with gazing eyes,"X Gui, K Toda, SH Seo, FM Eckert, CM Chang",2023,Extended Abstracts of …,2
Rise: A velocity control framework with minimal impacts based on reinforcement learning,"Y Xia, S Liu, X Chen, Z Xu, K Zheng, H Su",2022,Proceedings of the 31st ACM …,5
Road object detection: A comparative study of deep learning-based algorithms,"M Haris, A Glowacz",2021,Electronics,67
Adopting Aviation Safety Knowledge into the Discussions of Safe Implementation of Connected and Autonomous Road Vehicles,"UZA Hamid, M Mehndiratta, E Adali",2021,NA,0
FIR-based Future Trajectory Prediction in Nighttime Autonomous Driving,"A Rahimpour, N Fallahinia, D Upadhyay",2023,arXiv preprint arXiv …,0
Characterization and mitigation of insufficiencies in automated driving systems,"Y Fu, J Seemann, C Hanselaar, T Beurskens",2024,arXiv preprint arXiv …,2
Smart: A decision-making framework with multi-modality fusion for autonomous driving based on reinforcement learning,"Y Xia, S Liu, R Hu, Q Yu, X Feng, K Zheng",2023,… Conference on Database …,1
"Testing autonomous vehicles and AI: perspectives and challenges from cybersecurity, transparency, robustness and fairness","DF Llorca, R Hamon, H Junklewitz, K Grosse",2024,arXiv preprint arXiv …,0
Autonomous Height Adjustable Speed Reducer,"D Batra, A Sharma, V Wasson",2023,2023 3rd International …,1
A survey of recent advances in edge-computing-powered artificial intelligence of things,"Z Chang, S Liu, X Xiong, Z Cai",2021,IEEE Internet of Things …,185
Planning Guidance and Navigation for Autonomous Distributed Aerospace Platforms,F Causa,2020,Ph. D. Dissertation,5
The potential for blockchain and artificial intelligence to enhance the transport sector,DC Karlson'Charlie'Hargroves,2021,Journal of Civil …,6
The impact of a dedicated lane for connected and automated vehicles on the behaviour of drivers of manual vehicles,"SR Rad, H Farah, H Taale, B van Arem",2021,… research part F: traffic …,38
Attribute Annotation and Bias Evaluation in Visual Datasets for Autonomous Driving,"DF Llorca, P Frau, I Parra, R Izquierdo",2023,arXiv preprint arXiv …,0
MEMS: From a Bright Past Towards a Shining Future,"A Morcelli, S Ferri, A Hofmeister",2022,Silicon Sensors and Actuators: The …,1
Knowledge Representation for Driving Context Cognition in a Smartphone-based ADAS,"MD Hina, A Soukane",2021,… Conference on Electrical …,0
Deep Learning Based Autonomous Driving in Vehicular Networks,"Z Su, Y Hui, TH Luan, Q Liu, R Xing, Z Su, Y Hui",2021,The Next Generation …,2
Trajectories and Platoon-forming Algorithm for Intersections with Heterogeneous Autonomous Traffic,"PC Joshi, MAA Boon, SC Borst",2023,arXiv preprint arXiv:2311.07435,0
Computer Vision-Based Smart Helmet with Voice Assistant for Increasing,"Y Grover, SG Mishra, S Kumar, P Verma",2023,… and Applications of …,0
Recent advancements in deep learning applications and methods for autonomous navigation: A comprehensive review,"AA Golroudbari, MH Sabour",2023,arXiv preprint arXiv:2302.11089,13
"Survey on explainable AI: From approaches, limitations and Applications aspects","W Yang, Y Wei, H Wei, Y Chen, G Huang, X Li",2023,Human-Centric …,22
Vehicle Detection and Traffic Control Using Sensor Technology,"V Shanbhag, J Jacob",2023,2023 2nd International Conference on …,0
V2V and V2X Communications,"TS Ng, TS Ng",2021,Robotic Vehicles: Systems and Technology,1
A Survey of Generative AI for Intelligent Transportation Systems,"H Yan, Y Li",2023,arXiv preprint arXiv:2312.08248,3
Assessing the Development of Operator Trust in Automation,MJ Fowler,2021,NA,2
Road object detection: a comparative study of deep learning-based algorithms,"B Mahaur, N Singh, KK Mishra",2022,Multimedia Tools and Applications,37
CLAP: Cloud-and-learning-compatible autonomous driving platform,"Y Zhong, Z Cao, M Zhu, X Wang",2020,2020 IEEE Intelligent …,7
Dual license plate recognition and visual features encoding for vehicle identification,"Á Ramajo-Ballester, JMA Moreno",2024,… and Autonomous …,1
Neuromorphic Computing Architectures for EnergyEfficient Edge Devices in Autonomous Vehicles,"R Pradhan, A Gummadi, P Tanusha",2024,2024 Third …,0
Blockchain technology for intelligent transportation systems: A systematic literature review,"R Jabbar, E Dhib, AB Said, M Krichen, N Fetais",2022,IEEE …,108
Video compression prototype for autonomous vehicles,Y Wiseman,2024,Smart Cities,1
An Overview of Security and Privacy Challenges in Connected Autonomous Vehicles,HAA Ghazaleh,2022,Tensorgate Journal of Sustainable …,0
Low-Power Traffic Surveillance using Multiple RGB and Event Cameras: A Survey,"T Fleck, S Pavlitska, S Nitzsche",2023,2023 IEEE …,1
Vehicle-to-Person Interaction: A Survey,"C Palacio, E Gamess",2020,Revista Venezolana de Computación,1
