Title,Authors,Year,Venue,Citations
Game theory-based framework for modeling human–vehicle interactions on the road,"Y Rahmati, A Talebpour, A Mittal",2020,Transportation …,18
External Human-Machine Interfaces: Which of 729 colors is best for signaling 'Please (do not) cross'?,"P Bazilinskyy, D Dodou",2020,2020 IEEE International …,35
Enhanced perception for autonomous driving using semantic and geometric data fusion,"H Florea, A Petrovai, I Giosan, F Oniga, R Varga",2022,Sensors,17
Dynamic Spatio-temporal Graph Neural Network for Surrounding-aware Trajectory Prediction of Autonomous Vehicles,"H Sadid, C Antoniou",2024,IEEE Transactions on Intelligent Vehicles,1
Group vehicle trajectory prediction with global spatio-temporal graph,"D Xu, X Shang, Y Liu, H Peng",2022,IEEE Transactions on …,23
A comparative study of state-of-the-art driving strategies for autonomous vehicles,"C Zhao, L Li, X Pei, Z Li, FY Wang, X Wu",2021,Accident Analysis & Prevention,95
Autonomous Vehicle Along with Surrounding Agent's Path Prediction Using CNN-Based Models,"RP Kumar, K Srinivas, J Amudha",2023,… International Conference on …,0
"Where We're Going, We Don't Need Drivers: Autonomous Vehicles and AI-Chaperone Liability",PY Kim,2020,Cath. UL Rev.,7
Learning navigation priors based on adaptive data aggregation,V Widhalm,2023,NA,0
A review of occluded objects detection in real complex scenarios for autonomous driving,"J Ruan, H Cui, Y Huang, T Li, C Wu, K Zhang",2023,Green energy and intelligent …,9
Defensive or competitive Autonomous Vehicles: Which one interacts safely and efficiently with pedestrians?,"H Zhu, W Alhajyaseen, M Iryo-Asano",2022,Physica A: Statistical …,3
Design and Analysis of Different Behaviors of Autonomous Vehicles using Petrinets,"CJ Chandnani, R Raj",2023,… Conference on Computing …,0
Development of Behavior-Based Control Systems for Autonomous Vehicle Navigation in Urban Environment,AH Al-Salah,2022,NA,0
Ghost on the windshield: Employing a virtual human character to communicate pedestrian acknowledgement and vehicle intention,"A Rouchitsas, H Alm",2022,Information,9
A Dynamic Evolution Method for Autonomous Vehicle Groups in an Urban Scene,"G Yuan, J Cheng, MC Zhou, S Cheng",2022,"… on Systems, Man …",2
A Comprehensive Survey Exploring the Multifaceted Interplay between Mobile Edge Computing and Vehicular Networks,"A Pashazadeh, G Nardini, G Stea",2023,Future Internet,1
Advancing Explainable Autonomous Vehicle Systems: A Comprehensive Review and Research Roadmap,"S Tekkesinoglu, A Habibovic, L Kunze",2024,arXiv preprint arXiv:2404.00019,1
"Smart cities, urban mobility and autonomous vehicles","MA Richter, M Hagenmaier, O Bandte",2022,… and Social Change,1
Impact of Autonomous Vehicles on Capacity of a Two-Lane Highway,"VA Ajay Swaroog, S Alex, P Radhakrishnan",2022,International Conference on …,0
PI-NeuGODE: Physics-Informed Graph Neural Ordinary Differential Equations for Spatiotemporal Trajectory Prediction,"Z Mo, Y Fu, X Di",2024,… of the 23rd International Conference on Autonomous …,3
A systematic review of urban navigation systems for visually impaired people,"FEZ El-Taher, A Taha, J Courtney, S Mckeever",2021,Sensors,57
User Acceptance of Autonomous Vehicles: Review and Perspectives on the Role of the Human-machine Interfaces,"M Yan, L Rampino, G Caruso",2023,Computer-Aided Design and …,5
Drivetruth: Automated autonomous driving dataset generation for security applications,R Muller,2022,Workshop on Automotive and Autonomous Vehicle …,8
"The rise of drones in internet of things: A survey on the evolution, prospects and challenges of unmanned aerial vehicles","NS Labib, MR Brust, G Danoy, P Bouvry",2021,IEEE Access,58
Behavior prediction of traffic actors for intelligent vehicle using artificial intelligence techniques: A review,"S Kolekar, S Gite, B Pradhan, K Kotecha",2021,IEEE Access,20
Street View Object Detection for Autonomous Car Steering Angle Prediction Using Convolutional Neural Network,"I Sonata, Y Heryadi, W Budiharto",2021,2021 1st International …,1
"A Preliminary Exploration of Overtrust, Undertrust, and Right Amount of Trust in Autonomous Vehicle and Pedestrian Interaction",M Islam,2023,NA,0
"Continual learning for real-world autonomous systems: Algorithms, challenges and frameworks","K Shaheen, MA Hanif, O Hasan, M Shafique",2022,Journal of Intelligent & …,53
Empowering pedestrian safety: unveiling a lightweight scheme for improved vehicle-pedestrian safety,"K Rabieh, R Samir, MA Azer",2024,Information,0
A survey on the current security landscape of intelligent transportation systems,"A Lamssaggad, N Benamar, AS Hafid, M Msahli",2021,IEEE Access,107
Research on pedestrian vehicle collision warning based on path prediction,"Y Zhang, X Wang, K Zhuo, W Jiao",2023,2023 7th International …,2
Predicting vehicle trajectory via combination of model-based and data-driven methods using Kalman filter,"B Zhang, W Yu, Y Jia, J Huang",2023,Proceedings of the …,3
Assistive self-driving car networks to provide safe road ecosystems for disabled road users,"J Guerrero-Ibañez, J Contreras-Castillo",2023,Machines,1
"Agent-based models in urban transportation: review, challenges, and opportunities","FF Bastarianto, TO Hancock, CF Choudhury",2023,European Transport …,10
AI-TP: Attention-based interaction-aware trajectory prediction for autonomous driving,"K Zhang, L Zhao, C Dong, L Wu",2022,IEEE Transactions on …,65
EgoSpeed-net: Forecasting speed-control in driver behavior from egocentric video data,"Y Ding, Z Zhang, Y Li, X Zhou",2022,… of the 30th International Conference on …,3
Millimeter-Wave Vehicle-to-Infrastructure Communications for Autonomous Vehicles: Location-Aided Beam Forecasting in 6G,"OB Makadia, DK Patel, KD Shah",2024,2024 16th …,0
Vehicle crash simulations for safety: Introduction of connected and automated vehicles on the roadways,"R Ren, H Li, T Han, C Tian, C Zhang, J Zhang",2023,Accident Analysis & …,9
Network Development and Autonomous Vehicles: A Smart Transportation Testbed at Fort Carson: Project Report Summary and Recommendations,"LL Larkin, TA Carlson, WR D'Andrea, AL Johnson",2022,NA,0
Shared cross-modal trajectory prediction for autonomous driving,"C Choi, JH Choi, J Li, S Malla",2021,Proceedings of the IEEE …,65
Autonomous vehicle trajectory prediction on multi-lane highways using attention based model,"O Sharma, NC Sahoo, NB Puhan",2023,2023 IEEE 3rd International …,4
"Enabling technologies for urban smart mobility: Recent trends, opportunities and challenges","S Paiva, MA Ahad, G Tripathi, N Feroz, G Casalino",2021,Sensors,233
Maneuver-based trajectory prediction for self-driving cars using spatio-temporal convolutional networks,"B Mersch, T Höllen, K Zhao",2021,2021 IEEE/RSJ …,36
SPAS: Smart pothole-avoidance strategy for autonomous vehicles,"G Raja, S Anbalagan, S Senthilkumar",2022,IEEE Transactions …,21
"A review of 6G autonomous intelligent transportation systems: Mechanisms, applications and challenges","X Deng, L Wang, J Gui, P Jiang, X Chen, F Zeng",2023,Journal of Systems …,38
Incorporating Social Information into an Autonomous Vehicle's Decision-Making Process and Control,K Mokhtari,2021,NA,1
Augmented reality interfaces for pedestrian-vehicle interactions: An online study,"W Tabone, R Happee, J García, YM Lee",2023,… research part F: traffic …,6
Linked vehicle model: A simple car-following model for automated vehicles,"Y Xiao, Y Liu, X Song, Y Wu",2021,Proceedings of the Institution of …,8
Driving in the dark: designing autonomous vehicles for reducing light pollution,"T Stone, F Santoni de Sio, PE Vermaas",2020,Science and engineering ethics,44
"3D object detection for autonomous driving: Methods, models, sensors, data, and challenges","A Ghasemieh, R Kashef",2022,Transportation Engineering,39
Evolution of Equipment in Electromobility and Autonomous Driving Regarding Safety Issues,"C Katis, A Karlis",2023,Energies,2
Graph neural networks in IoT: A survey,"G Dong, M Tang, Z Wang, J Gao, S Guo, L Cai",2023,ACM Transactions on …,70
Impatience on Autonomous Vehicle Decision Making & Urban Infrastructure Management,GF Mudrak,2020,NA,0
Towards safe autonomy in hybrid traffic: Detecting unpredictable abnormal behaviors of human drivers via information sharing,"J Wang, L Su, S Han, D Song, F Miao",2023,ACM Transactions on Cyber …,1
Research on Safety Evaluation and Optimization of Children's General School Environment,Y Zeng,2023,Open Access Library Journal,0
POSITIONING PERFORMANCE OF LOW-COST U-BLOX NEO-M8U MODULE IN URBAN ENVIRONMENT.,"M Kacmarik, D Fojtik",2023,MM Science Journal,2
Off road autonomous vehicle modeling and repeatability using real world telemetry via simulation,"MP Spencer, JP Bos",2022,Autonomous Systems: Sensors …,2
Trep: Transformer-based evidential prediction for pedestrian intention with uncertainty,"Z Zhang, R Tian, Z Ding",2023,Proceedings of the AAAI Conference on …,14
Simulation Driven Development Process Utilizing Carla Simulator for Autonomous Vehicles.,"M Won, S Kim",2022,SIMULTECH,3
Autonomous driving policy continual learning with one-shot disengagement case,"Z Cao, X Li, K Jiang, W Zhou, X Liu",2022,IEEE Transactions …,17
"Omnidirectional Autonomous Robotic Platform for Advanced Driver Assistance Systems Testing—Movement, Localization and Navigation Possibilities","O Lufinka, J Kadeřábek, J Prstek, J Skála",2022,International Journal of …,1
A Review on Simulation Platforms for Agent-Based Modeling in Electrified Transportation,"D Harris, FL Da Silva, W Su",2023,IEEE Transactions on …,1
Simulating the impact of autonomous vehicles (AVs) on intersections traffic conditions using TRANSYT and PTV Vissim,"A Szarata, P Ostaszewski, H Mirzahossein",2023,Innovative Infrastructure …,3
Potential risk assessment for safe driving of autonomous vehicles under occluded vision,"D Wang, W Fu, Q Song, J Zhou",2022,Scientific reports,24
AutoNav: A Lane and Object Detection Model for Self-Driving Cars,"SS Madhumitha, R Sailesh, A Sirish",2022,… Methods and Data …,0
"Study of driving behavior in Ilioupolis, Athens according to the environmental affordances theory","E Bakogiannis, C Kyriakidis",2021,European Journal of Formal Sciences and …,1
End to End Pedestrian Features Detection for Self Driving Cars,"U Sri Krishna, S Keerthivasan, K Prudhvi",2023,… Conference on Smart …,0
Clustering traffic scenarios using mental models as little as possible,"F Hauer, I Gerostathopoulos, T Schmidt",2020,2020 IEEE Intelligent …,49
Advanced driver assistant systems focused on pedestrians' safety: a user experience approach,"M Šucha, R Risser, K Honzíčková",2021,Sustainability,8
S3C: Spatial Semantic Scene Coverage for Autonomous Vehicles,"T Woodlief, F Toledo, S Elbaum",2024,Proceedings of the IEEE …,0
Toward Large Scale Test for Autonomous Driving Software in Collaborative Virtual Environment,"BG Kim, E Kang",2023,Ieee Access,1
Cyclist and pedestrian trust in automated vehicles: An on-road and simulator trial,"J Parkin, F Crawford, J Flower, C Alford",2023,… journal of sustainable …,17
CU Driver-Outer UI for autonomous public transport,P Renström,2020,Diploma work,0
Transformer based composite network for autonomous driving trajectory prediction on multi-lane highways,"O Sharma, NC Sahoo, NB Puhan",2024,Applied Intelligence,1
FinnForest dataset: A forest landscape for visual SLAM,"I Ali, A Durmush, O Suominen, J Yli-Hietanen",2020,… and Autonomous …,34
NOVEL METHODS IN TRAINING AUTONOMOUS VEHICLES FOR URBAN ROADS,R Vasquez,2020,NA,0
My eyes speak: Improving perceived sociability of autonomous vehicles in shared spaces through emotional robotic eyes,"Y Wang, S Wijenayake, M Hoggenmüller",2023,Proceedings of the …,2
Use of social interaction and intention to improve motion prediction within automated vehicle framework: A review,"DE Benrachou, S Glaser, M Elhenawy",2022,IEEE Transactions …,11
Real-time people re-identification and tracking for autonomous platforms using a trajectory prediction-based approach,"AȘ Ghiță, AM Florea",2022,Sensors,5
Autonomous vehicles and street design: Exploring the role of medians in enhancing pedestrian street crossing safety using a virtual reality experiment,"Y Joo, SN Kim, BC Kim, GH Cho, J Kim",2023,Accident Analysis & Prevention,3
Navigating an automated driving vehicle via the early fusion of multi-modality,"M Haris, A Glowacz",2022,Sensors,20
Vehicle scheduling for on-demand vehicle fleets in macroscopic travel demand models,"J Hartleb, M Friedrich, E Richter",2022,Transportation,16
Emotional interaction design for driverless food truck under campus scenarios,"M Yan, J Wang, W Wang",2020,Advances in Industrial Design: Proceedings of …,2
Cyber-security oriented co-simulation platform for connected and autonomous driving,"A Abdo, G Wu, N Abu-Ghazaleh",2022,NA,1
Enhancing Pedestrian Safety in Autonomous Vehicles through Machine Learning,"SR Kothuri, V Nivedita, P Padmaloshani",2023,2023 International …,1
Selected aspects of the road infrastructure in relation to vehicle automation,"A Barsos, C Koren, E Makó, D Miletics, R Nagy",2020,NA,1
Learning configurations of operating environment of autonomous vehicles to maximize their collisions,"C Lu, Y Shi, H Zhang, M Zhang, T Wang",2022,IEEE Transactions …,37
How well can driverless vehicles hear? an introduction to auditory perception for autonomous and smart vehicles,"L Marchegiani, X Fafoutis",2021,IEEE Intelligent Transportation …,9
Designing Interactions With Shared AVs in Complex Urban Mobility Scenarios,"M Hoggenmueller, M Tomitsch",2022,Frontiers in Computer …,7
Spatial-temporal graph neural network for interaction-aware vehicle trajectory prediction,"J Chen, Y Wang, R Wu",2021,2021 IEEE 17th …,9
Characteristics of dangerous scenarios between vehicles turning right and pedestrians under left-hand traffic,"Y Matsui, S Oikawa",2023,Applied Sciences,3
Interaction-aware decision-making for automated vehicles using social value orientation,"L Crosato, HPH Shum, ESL Ho",2022,IEEE Transactions on …,40
A review of tracking and trajectory prediction methods for autonomous driving,"F Leon, M Gavrilescu",2021,Mathematics,132
Synchronous roundabouts with rotating priority sectors (SYROPS): High capacity and safety for conventional and autonomous vehicles,"G Ibanez, T Meuser, MA Lopez-Carmona",2020,Electronics,8
Factors affecting pedestrians' trust in automated vehicles: Literature review and theoretical model,"S Zhou, X Sun, B Liu, G Burnett",2021,IEEE Transactions on Human …,19
Multi-vehicle trajectory prediction and control at intersections using state and intention information,"D Zhu, Q Khan, D Cremers",2024,Neurocomputing,0
Learning data-driven decision-making policies in multi-agent environments for autonomous systems,"J Hook, S El-Sedky, V De Silva, A Kondoz",2021,Cognitive Systems Research,19
"How should autonomous vehicles drive? Policy, methodological, and social considerations for designing a driver","AY Bin-Nun, P Derler, N Mehdipour",2022,Humanities and social …,13
Road Image Segmentation for Autonomous Car,"B Bhatia, P Modi",2023,NA,0
Exception Model for Brake Light Detection for Autonomous Vehicles,"SD Jagtap, SS Kanade",2022,2022 2nd International Conference on …,2
DGInet: Dynamic graph and interaction-aware convolutional network for vehicle trajectory prediction,"J An, W Liu, Q Liu, L Guo, P Ren, T Li",2022,Neural Networks,26
Digital Twin Test Method With LTE-V2X for Autonomous Vehicle Safety Test,"J Duan, Z Wang, X Jing",2024,IEEE Internet of Things Journal,0
The planning process of transport tasks for autonomous vans—Case study,"J Caban, A Nieoczym, A Dudziak, T Krajka",2022,Applied Sciences,13
"Applications, databases and open computer vision research from drone videos and images: a survey","Y Akbari, N Almaadeed, S Al-Maadeed",2021,Artificial Intelligence …,79
Vehicle distance and speed estimation algorithm for computer vision sensor system,"M Gorobetz, J Timofejevs",2021,2021 IEEE 62nd …,4
Effective Techniques for Pedestrian Detection in Smart Autonomous Vehicles,"S Thylashri, N Manikandaprabu, T Jayakumar",2021,Technology,0
Vulnerable road users and the coming wave of automated vehicles: Expert perspectives,"W Tabone, J De Winter, C Ackermann",2021,Transportation research …,149
A survey on graph neural networks in intelligent transportation systems,"H Li, Y Zhao, Z Mao, Y Qin, Z Xiao, J Feng, Y Gu",2024,arXiv preprint arXiv …,7
Vehicle sideslip trajectory prediction based on time-series analysis and multi-physical model fusion,"L Cao, Y Luo, Y Wang, J Chen",2023,Journal of Intelligent and …,4
GarchingSim: An Autonomous Driving Simulator with Photorealistic Scenes and Minimalist Workflow,"L Zhou, Y Song, Y Gao, Z Yu",2023,2023 IEEE 26th …,1
Improve traffic organization in the passenger gravitation zone,"R Bakhrom, L Lan",2021,… on Wavelet Active Media Technology and …,2
Spatio-temporal graph dual-attention network for multi-agent prediction and tracking,"J Li, H Ma, Z Zhang, J Li",2021,IEEE Transactions on …,73
Parking prediction in smart cities: A survey,"X Xiao, Z Peng, Y Lin, Z Jin, W Shao",2023,IEEE Transactions …,8
A study on passengers' alighting and boarding process at metro platform by computer simulation,"Z Li, SM Lo, J Ma, XW Luo",2020,Transportation Research Part A: Policy and …,30
"Mode choice analysis of first-mile shared autonomous vehicles service in Bangkok, Thailand","A Karoonsoontawong, AT Win",2023,Proceedings of the …,0
Verification and Validation Utilizing Carla Simulator for Autonomous Driving Development,"M Won, S Kim",2022,International Conference on Simulation and Modeling …,0
Autonomous shuttle operating on highways and gravel roads in rural America: A demonstration study,"J Mason, C Carney, J Gaspar",2022,Geriatrics,5
A fail-safe architecture for automated driving,"S Vom Dorff, B Böddeker, M Kneissl",2020,"… Design, Automation & …",16
Inaction: Interpretable action decision making for autonomous driving,"T Jing, H Xia, R Tian, H Ding, X Luo, J Domeyer",2022,… on Computer Vision,21
Resource Optimization for Task Offloading With Real-Time Location Prediction in Pedestrian-Vehicle Interaction Scenarios,"D Zheng, L Wang, C Kai, M Peng",2023,IEEE Transactions on …,1
The interacting multiple model smooth variable structure filter for trajectory prediction,"S Akhtar, S Habibi",2023,IEEE Transactions on Intelligent …,11
Trajectory prediction network of autonomous vehicles with fusion of historical interactive features,"Z Zuo, X Wang, S Guo, Z Liu, Z Li",2023,IEEE Transactions on …,10
A review of vehicle-to-vulnerable road user collisions on limited-access highways to support the development of automated vehicle safety assessments,"H Muslim, J Antona-Makoshi",2022,Safety,6
Active road user interactions with autonomous vehicles: proactive safety assessment,"AR Alozi, M Hussein",2023,Transportation research record,6
Pedestrian Movement Prediction Based on Camera Vision and Deep Learning Model,"AM Herrero, C Pérez-Benito, DP Salido",2023,2023 IEEE 26th …,0
Moment-based model predictive control of autonomous systems,"HQ Bao, Q Kang, XD Shi, MC Zhou",2023,IEEE Transactions …,12
Smart Crosswalk Management with Vehicle-to-Pedestrian Communication,"S Srinivasan, R Raman, CB Thacker",2023,2023 International …,13
Low latency trajectory predictions for interaction aware highway driving,"C Anderson, R Vasudevan",2020,IEEE Robotics and …,3
Developing robust autonomous vehicles with ROS,"DJ Kangas, M Salem, K Li, T Ryynanen",2024,Autonomous …,0
Automated 3d object reference generation for the evaluation of autonomous vehicle perception,"R Philipp, Z Zhu, J Fuchs, L Hartjen",2021,… on System Reliability …,6
Exiting the simulation: The road to robust and resilient autonomous vehicles at scale,R Chakra,2022,arXiv preprint arXiv:2210.10876,2
Divergent Paths: An Analysis of the Autonomous Future in McLean County,C Peterson,2020,NA,0
Demystifying Artificial Intelligence based Behavior Prediction of Traffic Actors for Autonomous Vehicle-A Bibliometric Analysis of Trends and Techniques,"SS Kolekar, SS Gite, B Pradhan",2021,Library Philosophy and …,2
Implementation of Autonomous Dimming Based on Iot for Preventing Accidents,"R Kiruthikaa, BM Kumar, S Gopinath",2023,2023 International …,0
Optimization-based intersection control for connected automated vehicles and pedestrians,"T Niels, K Bogenberger",2024,Transportation …,3
Multistep ahead prediction of vehicle lateral dynamics based on echo state model,"C Teng, Y Cai, X Sun, X Sun, H Wang",2022,IEEE Sensors …,3
A Research Platform for Autonomous Vehicles Technologies Research in the Insurance Sector,"MÁ Miguel Paraiso, FM Moreno Olivo, P Marín Plaza",2020,NA,0
Driver intention prediction at roundabouts,"V Raimundo, M Favio",2021,2021 XIX Workshop on Information …,1
Control of autonomous UAV using an onboard LSTM neural network,B Karakostas,2023,Journal of Ubiquitous Systems & Pervasive Networks,1
An Inclusive Design Approach to Integrating an External Human Machine Interface with Autonomous Vehicles,S Roksic,2021,NA,0
Hybrid cooperative intersection management for connected automated vehicles and pedestrians,"P Cai, J He, Y Li",2023,Journal of Intelligent and Connected …,4
Time-to-approach-based model predictive controller for autonomous vehicle safety during unexpected wheelchairs on the path,"M Islam, M Chowdhury, M Rahman",2023,Cyber-Physical …,0
Walking in the era of autonomous vehicles,"S Pettigrew, L Booth, V Farrar, B Godic, J Brown, C Karl",2022,Sustainability,5
Situation-aware left-turning connected and automated vehicle operation at signalized intersections,"SM Khan, M Chowdhury",2021,IEEE Internet of Things Journal,11
iDriving: Toward safe and efficient infrastructure-directed autonomous driving,"F Ahmad, C Shin, W Pang, J Cashman, B Leong",2022,arXiv preprint arXiv …,1
V2V-based Collision-avoidance Decision Strategy for Autonomous Vehicles Interacting with Fully Occluded Pedestrians at Midblock on Multilane Roadways,"F Zou, HW Deng, TU Iunn, JH Ogle",2023,… on Transportation and …,2
Exploring diversity-based active learning for 3d object detection in autonomous driving,"Z Liang, X Xu, S Deng, L Cai, T Jiang, K Jia",2022,arXiv preprint arXiv …,14
Proposal of an autonomous vehicle control architecture,"CR Pozna, C Antonya",2021,2021 IEEE 25th International …,2
Effect of external HMI for automated vehicles (AVs) on drivers' ability to infer the AV motion intention: A field experiment,"V Papakostopoulos, D Nathanael, E Portouli",2021,… research part F: traffic …,21
Safety challenges for autonomous vehicles in the absence of connectivity,"A Shetty, M Yu, A Kurzhanskiy, O Grembek",2021,… research part C …,67
An Evaluation of External Human-Machine Interfaces and Compliance with Federal Motor Vehicle Safety Standard 108,"S Marulanda, N Britten, CC Chang, J Shutko",2023,NA,1
On Preference Modeling Techniques to Analyze Autonomous Vehicle Adoption and Use,GS Nair,2020,NA,0
Investigation of Autonomous/Connected Vehicles in Work Zones,SWZD Initiative,2021,NA,0
Applications of Computer Vision for the Improvement of Autonomous Vehicle Design,C Kauten,2021,NA,0
A Predictive-Prescriptive Safety Framework at Intersections in a Connected Vehicle Environment,E Zhang,2022,NA,0
Generation of modular and measurable validation scenarios for autonomous vehicles using accident data,"Q Goss, Y AlRashidi, Mİ Akbaş",2021,2021 IEEE Intelligent Vehicles …,20
Spatiotemporal learning of multivehicle interaction patterns in lane-change scenarios,"C Zhang, J Zhu, W Wang, J Xi",2021,IEEE Transactions on Intelligent …,45
"Interaction of automated driving systems with pedestrians: Challenges, current solutions, and recommendations for eHMIs","R Ezzati Amini, C Katrakazas, A Riener",2021,Transport …,31
… the Efficacy of Real-Time Connected Vehicle Basic Safety Messages in Mitigating Aberrant Driving Behaviour and Risk of Vehicle Crashes: Preliminary Insights from …,"N Zhong, MK Gupta, O Kochan",2024,Elektronika ir …,1
Urban Autonomous Driving of Emergency Vehicles with Reinforcement Learning,"Z Tong, A Ayala, EB Sandoval",2023,2023 IEEE Latin American …,0
Logistic autonomous vehicles assessment using decision support model under spherical fuzzy set integrated Choquet Integral approach,"SR Bonab, SJ Ghoushchi, M Deveci",2023,Expert Systems with …,49
"Towards comprehensive understanding of pedestrians for autonomous driving: Efficient multi-task-learning-based pedestrian detection, tracking and attribute …","Y Zhou, X Zeng",2024,Robotics and Autonomous Systems,1
Artificial intelligence and software modeling approaches in autonomous vehicles for safety management: A systematic review,"S Abbasi, AM Rahmani",2023,Information,7
Digital Transformation of the Transport Sector Towards Smart and Sustainable Mobility,"M Dimian, E Zadobrischi, A Căilean, C Beguni",2024,"… : Technology, Tools, and …",0
How to build a graph-based deep learning architecture in traffic domain: A survey,"J Ye, J Zhao, K Ye, C Xu",2020,IEEE Transactions on Intelligent …,225
"Autonomous driving strategies at intersections: Scenarios, state-of-the-art, and future outlooks","L Wei, Z Li, J Gong, C Gong, J Li",2021,2021 IEEE International …,51
Pre-instruction for Pedestrians Interacting Autonomous Vehicles with an eHMI: Effects on Their Psychology and Walking Behavior,"H Liu, T Hirayama",2023,arXiv preprint arXiv:2303.08380,1
A review on intention-aware and interaction-aware trajectory prediction for autonomous vehicles,"I Gomes, D Wolf",2023,Authorea Preprints,9
Integrated graphical representation of highway scenarios to improve trajectory prediction of surrounding vehicles,"L Hou, SE Li, B Yang, Z Wang",2022,IEEE Transactions on …,10
